Legal name,full_address,Lat,Long
DESERT SUN COUNSELLING AND RESOURCE CENTRE SOCIETY,"PO1890, 35649-97TH STREET, OLIVER, BC, V0H1T0, CA",49.2364117,-119.5305916
SCW'EXMX COMMUNITY HEALTH SERVICES SOCIETY,"PO BOX 3090 STN MAIN, MERRITT, BC, V1K1B8, CA",50.1110816,-120.7881949
SEVEN SACRED FIRES SOCIETY,"13632-110A AVENUE, SURREY, BC, V3R2B1, CA",49.2034656,-122.8443871
ICROSS CANADA INCORPORATED,"1883 PROSSER RD, SAANICHTON, BC, V8M1N4, CA",48.58860720000001,-123.4209289
CARITATE FOUNDATION,"2 - 1231 MCKENZIE ST, VICTORIA, BC, V8V2W6, CA",48.41417,-123.35139
SOUTH OKANAGAN/SIMILKAMEEN ARTS SOCIETY,"765-650 DUNCAN AVENUE WEST, PENTICTON, BC, V2A7N1, CA",49.48628360000001,-119.6043604
STEP BY STEP RECOVERY HOME SOCIETY,"12442 78A AVENUE, SURREY, BC, V3W7X2, CA",49.1453273,-122.877667
LUSH VALLEY FOOD ACTION SOCIETY,"PO BOX 20008 RPO DOWNTOWN, COURTENAY, BC, V9N0A7, CA",49.69055179999999,-124.9980618
FONDATION LAZARE,"116 - 2678 MCCALLUM RD, ABBOTSFORD, BC, V2S6X3, CA",49.0503483,-122.2930504
KASLO HOUSING SOCIETY,"BOX 925, KASLO, BC, V0G1M0, CA",49.91424989999999,-116.9154503
BRENTWOOD COLLEGE FOUNDATION,"2735 MOUNT BAKER RD., MILL BAY, BC, V0R2P1, CA",48.6537891,-123.5547954
THE CAPITAL REGION PROSTATE CENTRE,"203 - 1121 YATES ST, VICTORIA, BC, V8V3N1, CA",48.424711,-123.3529036
THE CINDERELLA PROJECT SOCIETY,"172 - 219 MACKAY RD, NORTH VANCOUVER, BC, V7P3N6, CA",49.3187076,-123.1029425
BUILDERS WITHOUT BORDERS FOUNDATION / FONDATION BATISSEURS SANS FRONTIERES,"1000 - 355 BURRARD ST, VANCOUVER, BC, V6C2G8, CA",49.2878426,-123.1163852
THE GRENDEL GROUP (FAMILY ADVOCATES),"PO BOX 969, SMITHERS, BC, V0J2N0, CA",54.782355,-127.1685541
BEECH FOUNDATION,"50 - 133 KEEFER ST, VANCOUVER, BC, V6A1X3, CA",49.2796057,-123.1013709
B.C. SOCIAL VENTURE PARTNERS FOUNDATION,"500 - 610 MAIN ST, VANCOUVER, BC, V6A2V3, CA",49.2793074,-123.099343
W J WEAVER FOUNDATION,"805 ROCHESTER AVE, COQUITLAM, BC, V3K2W3, CA",49.2456954,-122.8764928
B.C. ARTISTS IN HEALTHCARE SOCIETY,"#1001-1415 PARKWAY BLVD, COQUITLAM, BC, V3E0C7, CA",49.2979922,-122.8045264
LADYSMITH & DISTRICT HISTORICAL SOCIETY,"P.O. BOX 813, LADYSMITH, BC, V9G1A6, CA",48.9939001,-123.8194387
MAYNE ISLAND VOLUNTEER FIREFIGHTER'S ASSOCIATION,"520B FELIX JACK, MAYNE ISLAND, BC, V0N2J2, CA",48.8468335,-123.2849329
BC ATAXIA SOCIETY,"206 - 8611 ACKROYD RD, RICHMOND, BC, V6X3P4, CA",49.17246290000001,-123.1282721
WEST CRESTON COMMUNITY HALL SOCIETY,"1350 WEST CRESTON RD., RR 7, CRESTON, BC, V0B1G7, CA",49.08993599999999,-116.619724
SLOCAN VALLEY COMMUNITY COMPLEX SOCIETY,"PO BOX 33, SLOCAN, BC, V0G2C0, CA",49.76299299999999,-117.46992
CANADIAN NETWORK FOR THE PREVENTION OF ELDER ABUSE/RESEAU CANADIEN POUR LA PREVENTION DU MAUVAIS TRAITEMENT DES AINES,"1822 EAST MALL, VANCOUVER, BC, V6T1Y1, CA",49.2701102,-123.2533532
ABBEYFIELD HOUSE OF ARMSTRONG SPALLUMCHEEN SOCIETY,"3725 WOOD AVE, PO BOX 715, ARMSTRONG, BC, V0E1B0, CA",50.4476983,-119.1969938
CROFTON HOUSE SCHOOL FOUNDATION,"3200 WEST 41 ST AVE, VANCOUVER, BC, V6N3E1, CA",49.2343691,-123.1771922
KMC FOUNDATION,"4341 SOPHIA ST, VANCOUVER, BC, V5V3V6, CA",49.2462494,-123.0994717
NELSON AND AREA FRIENDS OF THE FAMILY FOUNDATION,"BOX B - 518 LAKE ST, NELSON, BC, V1L4G6, CA",49.49367489999999,-117.2944321
THE PACE CHILD AND FAMILY SOCIETY,"1524 W 65 AVENUE, VANCOUVER, BC, V6P2R1, CA",49.2120678,-123.1415759
LANGLEY HERITAGE TRUST,"6330 224 ST., LANGLEY, BC, V2Y2N8, CA",49.11807,-122.60313
CENTRAL OKANAGAN ASSOCIATION FOR CARDIAC HEALTH,"204-2622 PANDOSY STREET, KELOWNA, BC, V1Y1V6, CA",49.86696449999999,-119.491653
BIG WHITE COMMUNITY POLICING SOCIETY,"BOX 45077, KELOWNA, BC, V1P1P3, CA",49.8902959,-119.3877752
SQUAMISH WALDORF SCHOOL ASSOCIATION,"38265 WESTWAY AVE, SQUAMISH, BC, V8B0Y5, CA",49.7024254,-123.1308472
"THE CONNOR, CLARK & LUNN FOUNDATION","2300 - 1111 GEORGIA ST W, VANCOUVER, BC, V6E4M3, CA",49.2860466,-123.1233029
VANCOUVER HOSPICE SOCIETY,"4615 GRANVILLE ST, VANCOUVER, BC, V6H3M1, CA",49.2442652,-123.1397375
CEDAR SPRINGS FOUNDATION,"203 - 815 HORNBY ST, VANCOUVER, BC, V6Z2E6, CA",49.2824313,-123.1225062
CRESTON VALLEY COMMUNITY FOUNDATION,"PO BOX 701, CRESTON, BC, V0B1G0, CA",49.0955401,-116.5135079
GLOBAL CIVIC POLICY SOCIETY,"1604 1055 HOMER ST, VANCOUVER, BC, V6B1G3, CA",49.2768984,-123.1211362
CHRIS ROSE THERAPY CENTRE FOR AUTISM FOUNDATION,"1111 TRANQUILLE ROAD, KAMLOOPS, BC, V2B3J8, CA",50.7004499,-120.37128
TRUST UNDER THE WILL OF LINDSAY THOMPSON,"THE CANADA TRUST CO., PO BOX 10085, VANCOUVER, BC, V7Y1B6, CA",49.2830972,-123.1175032
KIWANIS NORTH SHORE HOUSING SOCIETY,"100-975-21ST STREET, WEST VANCOUVER, BC, V7V0B5, CA",49.333363,-123.1687038
NEW HOPE SCHOOLS SOCIETY,"26 - 2885 E KENT AVE NORTH, VANCOUVER, BC, V5S3T9, CA",49.2067602,-123.048726
L I F E RECOVERY ASSOCIATION,"BOX 2652, ABBOTSFORD, BC, V2T6R4, CA",49.038448,-122.3562199
FORT ST. JOHN AND DISTRICT PALLIATIVE CARE SOCIETY,"9812 - 108 AVENUE, FORT ST JOHN, BC, V1J2R3, CA",56.2541889,-120.8449692
THE ASLAN FOUNDATION,"701-150 ATHLETES WAY, VANCOUVER, BC, V5Y0B5, CA",49.2711415,-123.1087571
KOOTENAY EMPLOYMENT SERVICES SOCIETY,"BOX 548, 119 - 11TH AVENUE NORTH, CRESTON, BC, V0B1G0, CA",49.0960183,-116.5121404
GULF ISLANDS FAMILIES TOGETHER SOCIETY,"152 MCPHILLIPS AVE, SALTSPRING ISLAND, BC, V8K2V8, CA",48.8528099,-123.5035808
THOMPSON VIEW MANOR SOCIETY,"PO BOX 318, 710 ELM STREET, ASHCROFT, BC, V0K1A0, CA",50.7343532,-121.2794833
CHILLIWACK HOSPICE SOCIETY,"7112 VEDDER RD, CHILLIWACK, BC, V2R3T6, CA",49.131968,-121.959614
CHERNOFF FAMILY FOUNDATION,"401 2288 BELLEVUE AVE, WEST VANCOUVER, BC, V7V1C6, CA",49.331975,-123.1748673
THE PAUL MYERS FAMILY FOUNDATION,"2900-550 BURRARD STREET, VANCOUVER, BC, V6C0A3, CA",49.285784,-123.1182076
INTERNATIONAL CHINA CONCERN (CANADA),"7B-5707 SIDLEY ST, BURNABY, BC, V5J5E6, CA",49.2174233,-122.9806584
VANCOUVER FIRE FIGHTERS' CHARITABLE SOCIETY,"300 - 1060 AUSTIN AVE, COQUITLAM, BC, V3K3P3, CA",49.2487639,-122.8629403
MINERVA FOUNDATION FOR BC WOMEN,"320-111 HASTINGS ST W, VANCOUVER, BC, V6B1H4, CA",49.2823094,-123.1074431
KAMLOOPS FOOD POLICY COUNCIL,"286 TRANQUILLE RD, KAMLOOPS, BC, V2B3G3, CA",50.68731460000001,-120.3566021
ARROWSMITH COMMUNITY JUSTICE SOCIETY,"101 - 691 BEACH RD, QUALICUM BEACH, BC, V9K0A7, CA",49.346911,-124.447472
OCEANSIDE COMMUNITY SAFETY VOLUNTEERS,"101 - 691 BEACH RD, QUALICUM BEACH, BC, V9K0A7, CA",49.346911,-124.447472
PHOENIX MANOR SOCIETY,"BOX 2020 619 CENTRAL AVENUE, GRAND FORKS, BC, V0H1H0, CA",49.0326987,-118.4430954
MIGHTY OAKS FOUNDATION,"1250-1500 WEST GEORGIA ST, BOX 62, VANCOUVER, BC, V6G2Z6, CA",49.2900772,-123.1306778
PORT EDWARD HISTORICAL SOCIETY,"P.O. BOX 1100, 770 PACIFIC AVENUE, PORT EDWARD, BC, V0V1G0, CA",54.2216733,-130.2922538
COWICHAN FAMILY CAREGIVERS SUPPORT SOCIETY,"1843 TZOUHALEM RD, DUNCAN, BC, V9L5L6, CA",48.782673,-123.6528722
VANCOUVER ASSOCIATION OF RESTORATIVE JUSTICE,"#308-2410 CORNWALL STREET, VANCOUVER, BC, V6K1B8, CA",49.2724257,-123.1602327
METIS COMMUNITY SERVICES SOCIETY OF BC,"147 PARK RD, KELOWNA, BC, V1X3E3, CA",49.8883029,-119.3884034
GREAT EXPECTATIONS FOUNDATION,"203 - 815 HORNBY ST, VANCOUVER, BC, V6Z2E6, CA",49.2824313,-123.1225062
BILL REID FOUNDATION,"639 HORNBY ST, VANCOUVER, BC, V6C2G3, CA",49.2845871,-123.1194282
THE SARAH MCLACHLAN FOUNDATION,"200-138 EAST 7TH AVE, VANCOUVER, BC, V5T1M6, CA",49.2646205,-123.1009986
VAN DER ENDE CHARITABLE FOUNDATION,"18601 88 AVE, SURREY, BC, V4N5T1, CA",49.16301,-122.70739
MOVIE MONDAY SOCIETY,"2033 CHAUCER STREET, VICTORIA, BC, V8R1H6, CA",48.4270963,-123.3215849
DAVID ORCHARD FOUNDATION FOR CANADA,"44-1656 ADANAC STREET, VANCOUVER, BC, V5L2C6, CA",49.2772965,-123.071426
VALEMOUNT FOOD BANK SOCIETY,"PO BOX 35, VALEMOUNT, BC, V0E2Z0, CA",52.83122,-119.264311
THE SALTSPRING ISLAND HISTORICAL SOCIETY,"129 MCPHILLIPS AVENUE, SALTSPRING ISLAND, BC, V8K2T6, CA",48.85256709999999,-123.5015632
COMMUNITIES EMBRACING RESTORATIVE ACTION (CERA) SOCIETY,"644 POIRIER ST, COQUITLAM, BC, V3J6B1, CA",49.25578669999999,-122.8468449
OCEANSIDE VOLUNTEER ASSOCIATION,"A - 860 PARK PL, COURTENAY, BC, V9N8K6, CA",49.6737478,-124.990238
BC HEPATITIS NETWORK SOCIETY,"PO BOX 36576 RPO SEAFAIR, RICHMOND, BC, V7C5M4, CA",49.161219,-123.1723809
LIGHTHOUSE PARK PRESERVATION SOCIETY,"5371 KEW CLIFF ROAD, WEST VANCOUVER, BC, V7W1M3, CA",49.3494257,-123.2686165
GULF ISLANDS SENIORS RESIDENCE ASSOCIATION,"121 ATKINS ROAD, SUITE 100, SALT SPRING ISLAND, BC, V8K2X7, CA",48.8602997,-123.5149275
ROE LAKE AND DISTRICT RECREATION COMMISSION,"7592 HIGHWAY 24, LONE BUTTE, BC, V0K1X2, CA",51.5114598,-120.8320965
THE SONSHINE LUNCH CLUB,"505 6TH ST, COURTENAY, BC, V9N1M5, CA",49.689242,-125.0015826
CENTRAL OKANAGAN SEARCH & RESCUE SOCIETY,"BOX 260, 101-1865 DILWORTH DR, KELOWNA, BC, V1Y9T1, CA",49.880342,-119.4368221
JOHN VOLKEN FOUNDATION,"6911 KING GEORGE HWY, SURREY, BC, V3W5A1, CA",49.1272949,-122.846695
CHETWYND AND DISTRICT HOSPITAL FOUNDATION,"BOX 121, CHETWYND, BC, V0C1J0, CA",55.6976802,-121.6296734
24 HOUR RELAY FOR THE KIDS SOCIETY,"3981 OAK STREET, VANCOUVER, BC, V6H4H5, CA",49.2501076,-123.1277813
HISTORICAL DIVING SOCIETY - CANADA,"216 EAST ESPLANADE, NORTH VANCOUVER, BC, V7L1A3, CA",49.309611,-123.0755121
A CAPPELLA PLUS CHORAL SOCIETY,"P.O. BOX 333 STN A, NANAIMO, BC, V9R5L3, CA",49.163745,-124.036115
THE CENTER FOR EPILEPSY AND SEIZURE EDUCATION BRITISH COLUMBIA,"112 - 32868 VENTURA AVE, ABBOTSFORD, BC, V2S6J3, CA",49.052079,-122.312887
LAGNIAPPE FOUNDATION,"401-1505 WEST 2ND AVENUE, VANCOUVER, BC, V6H3Y4, CA",49.2698875,-123.1379953
VALHALLA FOUNDATION FOR ECOLOGY,"208 LAKTIN RD, NEW DENVER, BC, V0G1S1, CA",49.99129,-117.372071
THE COTTON TRUST FOR RURAL BEAUTIFICATION,"PO BOX 10085, VANCOUVER, BC, V7Y1B6, CA",49.2830972,-123.1175032
FORT STEELE CEMETERY SOCIETY,"1404 16TH ST S, CRANBROOK, BC, V1C6R5, CA",49.493485,-115.759356
POWELL RIVER BRAIN INJURY SOCIETY,"101-7020 DUNCAN ST, POWELL RIVER, BC, V8A1V9, CA",49.8358036,-124.5198228
VARSHNEY FAMILY FOUNDATION,"2050-1055 GEORGIA ST W, PO 11121 ROYAL CENTER, VANCOUVER, BC, V6E3P3, CA",49.2853911,-123.12155
WEST END-COAL HARBOUR COMMUNITY POLICING CENTRE,"1267 DAVIE ST, VANCOUVER, BC, V6E1N4, CA",49.2825439,-123.1343405
HORATIO ROLAND EGGLETON ESTATE,"PO BOX 10085, LCD PACIFIC CENTRE, VANCOUVER, BC, V7Y1B6, CA",49.283398,-123.1175396
SOCIETY FOR THE ENHANCEMENT OF QUALITY OF LIFE,"1270 TOPAZ AVE, VICTORIA, BC, V8T2N1, CA",48.4436905,-123.3527556
"B.C. SCHIZOPHRENIA SOCIETY, KELOWNA BRANCH","105 - 1610 BERTRAM STREET, KELOWNA, BC, V1Y2G4, CA",49.8850457,-119.490079
SALMO AND DISTRICT HOSPICE SOCIETY,"PO BOX 735, SALMO, BC, V0G1Z0, CA",49.194892,-117.2792769
THE PACIFIC INSTITUTE OF FAMILY EDUCATION,"6711 DUNSANY PLACE, RICHMOND, BC, V7C4N8, CA",49.1496117,-123.1509009
KAL TIRE CHRISTMAS FUNDRAISING SOCIETY,"P O BOX 1240, VERNON, BC, V1T6N6, CA",50.2656562,-119.2719942
COLLINGWOOD SCHOOL FOUNDATION,"70 MORVEN DRIVE, WEST VANCOUVER, BC, V7S1B2, CA",49.36046289999999,-123.1204071
COMTRANS FOUNDATION,"204-68 RICHMOND STREET, NEW WESTMINSTER, BC, V3L5S2, CA",49.2176322,-122.8956286
NIGHT HOOPS BASKETBALL SOCIETY,"1 KINGSWAY, VANCOUVER, BC, V5T3H7, CA",49.2643035,-123.1004011
WHITE ROCK MILLENNIUM CHARITABLE SOCIETY,"14132 20 AVE, SURREY, BC, V4A8P8, CA",49.0381963,-122.8309522
POWELL RIVER COMMUNITY FOUNDATION,"PO BOX 335 STN MAIN, POWELL RIVER, BC, V8A5C2, CA",49.846315,-124.5204383
STEWART & MARILYN BLUSSON FOUNDATION,"BOX 62 SUITE 1250, 1500 W GEORGIA ST, VANCOUVER, BC, V6G2Z6, CA",49.2900772,-123.1306778
NAKUSP HOSPICE SOCIETY,"BOX 87, NAKUSP, BC, V0G1R0, CA",50.2398537,-117.8011055
SAANICH LEGACY FOUNDATION,"P.O. BOX 48204, VICTORIA, BC, V8Z7H6, CA",48.508662,-123.407199
DISTRICT OF NORTH VANCOUVER MUNICIPAL PUBLIC LIBRARY,"1277 LYNN VALLEY RD, NORTH VANCOUVER, BC, V7J0A2, CA",49.3364071,-123.0387562
MAKEWAY FOUNDATION,"400, 163 HASTINGS STREET WEST, VANCOUVER, BC, V6B1H5, CA",49.2824733,-123.1091877
SIMPCW TSEPTEKWLL AND RESEARCH SOCIETY,"BOX 220, BARRIERE, BC, V0E1E0, CA",51.1824784,-120.1237108
PENDER HARBOUR COMMUNITY IMPROVEMENT FOUNDATION,"PO BOX 1610, SECHELT, BC, V0N3A0, CA",49.5627453,-123.7532017
VICTORIA COATS FOR KIDS ASSOCIATION,"2416 MOWAT STREET, VICTORIA, BC, V8R5S9, CA",48.4354589,-123.3156925
NANAIMO MARINE RESCUE SOCIETY,"P.O. BOX 146, STATION A, NANAIMO, BC, V9R5K9, CA",49.163745,-124.036115
THE BBC PEACE FOUNDATION,"3490 EDINBURGH STREET, PORT COQUITLAM, BC, V3B4K3, CA",49.2751965,-122.7714977
THE ROYAL CANADIAN LEGION #008 POPPY FUND,"2290-152 STREET, SURREY, BC, V4A4N9, CA",49.0436019,-122.8008135
SOUTH COLUMBIA SEARCH AND RESCUE SOCIETY,"BOX 697, FRUITVALE, BC, V0G1L0, CA",49.1137024,-117.5487834
DELTA COMMUNITY LIVING FOUNDATION,"1, 3800-72ND STREET, DELTA, BC, V4K3N2, CA",49.07152199999999,-123.0200501
FRASER HERITAGE SOCIETY,"215 KILBY ROAD, PO BOX 84, HARRISON MILLS, BC, V0M1L0, CA",49.2357918,-121.9569651
KELOWNA CARING CANINES SOCIETY,"#9 - 3151 LAKESHORE ROAD, SUITE 211, KELOWNA, BC, V1W3S9, CA",49.8606874,-119.4902996
CANADIAN RUGBY FOUNDATION,"PO BOX 8003, VICTORIA, BC, V8W3R7, CA",48.425114,-123.3647699
ZAMBIA MISSION FUND - CANADA,"4368 LOCHSIDE DRIVE, VICTORIA, BC, V8X2C9, CA",48.4899137,-123.3620003
THE KETTLE VALLEY RAILWAY SOCIETY,"PO BOX 1288, SUMMERLAND, BC, V0H1Z0, CA",49.603236,-119.6834179
STEPS TO THE FUTURE CHILD CARE SOCIETY,"6046 SOOKE RD, SOOKE, BC, V9Z0C1, CA",48.3873772,-123.6872073
STEWARDS' CHARITABLE FOUNDATION,"1250-1500 GEORGIA ST W, PO BOX 62, VANCOUVER, BC, V6G2Z6, CA",49.2900772,-123.1306778
THE SONSHINE STREET PRESCHOOL,"20098-22ND AVENUE, LANGLEY, BC, V2Z1X4, CA",49.0429055,-122.6658925
SHIPS POINT VOLUNTEER FIREFIGHTERS ASSOCATION,"7729 VIVIAN WAY, FANNY BAY, BC, V0R1W0, CA",49.5004026,-124.8010419
CAMPBELL RIVER HEAD INJURY SUPPORT SOCIETY,"591 9TH AVENUE, CAMPBELL RIVER, BC, V9W4B5, CA",50.02289640000001,-125.2476468
BROADWAY COMMUNITY OF HOPE SOCIETY,"535 EAST BROADWAY, VANCOUVER, BC, V5T1X4, CA",49.262651,-123.092096
ACACIA SPRING CHARITABLE FOUNDATION,"605 57TH AVE W, VANCOUVER, BC, V6P1R8, CA",49.2194314,-123.1192558
JUSTICE FOR GIRLS OUTREACH SOCIETY,"500 - 610 MAIN ST, VANCOUVER, BC, V6A2V3, CA",49.2793074,-123.099343
STEPS FORWARD - INCLUSIVE POST-SECONDARY EDUCATION SOCIETY,"4 - 46008 BOLE AVE, CHILLIWACK, BC, V2P2V5, CA",49.1728371,-121.9521348
NORTH PEACE PREGNANCY CARE CENTRE SOCIETY,"SUITE 335 9900-100 AVE., FORT ST JOHN, BC, V1J5S7, CA",56.246579,-120.846278
ISLAND CORRIDOR FOUNDATION,"183 HERITAGE DR, NANAIMO, BC, V9V1J9, CA",49.2377884,-123.9891953
WATERSHED WATCH SALMON SOCIETY,"210 - 128 HASTINGS ST W, VANCOUVER, BC, V6B1G8, CA",49.2819553,-123.1082395
MAKE A LIFE,"BOX 93  197 KOOTENAY LAKE RD., PROCTER, BC, V0G1V0, CA",49.6255818,-116.9391397
MOUNTAIN SPRUCE COMMUNITY CENTRE SOCIETY,"6335 MAHOOD LAKE ROAD, LONE BUTTE, BC, V0K1X3, CA",51.6076606,-120.8833767
BHAI GHANAYA INTERNATIONAL CHARITABLE SOCIETY,"#1, 13018-84TH AVE, SURREY, BC, V3W1L2, CA",49.1550444,-122.8619638
MEDICOS EN ACCION SOCIETY,"450 GREENSTONE DRIVE, KAMLOOPS, BC, V2C1N9, CA",50.6713526,-120.3500805
FRIENDS OF THE SMITHERS LIBRARY,"BOX 55, SMITHERS, BC, V0J2N0, CA",54.782355,-127.1685541
HOPE FOR FREEDOM SOCIETY,"3237 LIVERPOOL, PORT COQUITLAM, BC, V3B3V5, CA",49.2714205,-122.7605634
FRIENDS OF HONDURAS SOCIETY--SOCIEDAD DE AMIGOS DE HONDURAS,"3801 ASCOT DRIVE, VICTORIA, BC, V8P3S2, CA",48.4632088,-123.3457439
MAKE A LIFE FOUNDATION,"PO BOX 29101 RPO OKANAGAN, KELOWNA, BC, V1W4A7, CA",49.8611566,-119.483624
KOOTENAY COLUMBIA TRAILS SOCIETY,"PO BOX 1179, ROSSLAND, BC, V0G1Y0, CA",49.0781415,-117.8000037
THE PENDER ISLAND BETHESDA FOUNDATION,"3205 6TH STREET SOUTH, CRANBROOK, BC, V1C6K1, CA",49.503123,-115.735653
LORD TENNYSON OUT-OF-SCHOOL CARE SOCIETY,"P.O. BOX 14066, DELAMONT PO, VANCOUVER, BC, V6J0B9, CA",49.26352,-123.14485
THE SCHUBERT FOUNDATION,"401 - 3003 GATEBY PL, VERNON, BC, V1T9H5, CA",50.2649813,-119.2816285
F & E STRUMPSKI FOUNDATION,"32575 SIMON AVENUE, ABBOTSFORD, BC, V2T4W6, CA",49.0535889,-122.3217904
FRIENDS OF HISTORIC HAT CREEK RANCH,"3484 JACKSON ROAD, PO BOX 878, CACHE CREEK, BC, V0K1H0, CA",50.8108099,-121.3233237
FORT NELSON HOSPITAL & HEALTHCARE FOUNDATION,"BAG 1000, FORT NELSON, BC, V0C1R0, CA",58.8050174,-122.697236
BETHANY CHILD CARE SOCIETY,"22680 WESTMINSTER HIGHWAY, RICHMOND, BC, V6V1B7, CA",49.1732296,-122.9693203
THE BARRY LAPOINTE FOUNDATION,"PO BOX 11117 STN ROYAL, VANCOUVER, BC, V6E4N7, CA",49.282905,-123.1305109
MID ISLAND KIDNEY ASSOCIATION,"8932 FABER RD, PORT ALBERNI, BC, V9Y9B9, CA",49.2771494,-124.9278319
SOUTH COWICHAN ROTARY CLUB FOUNDATION,"1757 SHAWNIGAN MILL BAY RD, BOX 157, SHAWNIGAN LAKE, BC, V0R2W0, CA",48.6537866,-123.6217899
THE ABBEYFIELD HOUSES ALBERNI VALLEY SOCIETY,"3839 8TH AVENUE, PORT ALBERNI, BC, V9Y8J6, CA",49.2458957,-124.8001254
BROOKE AND TRACEY WADE FOUNDATION,"SUITE 500-1195 WEST BROADWAY, VANCOUVER, BC, V6H3X5, CA",49.2638217,-123.1309794
DJAVAD MOWAFAGHIAN FOUNDATION,"404-1111 LONSDALE AVE, NORTH VANCOUVER, BC, V7M2H4, CA",49.31918,-123.071882
FULFORD COMMUNITY HALL ASSOCIATION,"2591 FULFORD GANGES ROAD, SALT SPRING ISLAND, BC, V8K1Z4, CA",48.7723626,-123.4660594
EASTSIDE MOVEMENT FOR BUSINESS AND ECONOMIC RENEWAL SOCIETY,"310-111 HASTINGS ST W, VANCOUVER, BC, V6B1H4, CA",49.2828817,-123.1104832
DIANE HARWOOD MEMORIAL TRUST,"850 - 1095 PENDER ST W, VANCOUVER, BC, V6E2M6, CA",49.2876054,-123.1197994
THE COMMUNITY HARVEST FOOD BANK,"301 32ND ST, CASTLEGAR, BC, V1N3S6, CA",49.271638,-117.64532
CONNEC TRA SOCIETY,"318-425 CARRALL STREET, VANCOUVER, BC, V6B6E3, CA",49.2812047,-123.1046522
COMOX VALLEY GROUND SEARCH AND RESCUE ASSOCIATION,"BOX 3511, COURTENAY, BC, V9N5N5, CA",49.657881,-124.9682479
ALIZA AND CHAIM KORNFELD FOUNDATION,"640 - 943 WEST BROADWAY, VANCOUVER, BC, V5Z4E1, CA",49.263143,-123.1186006
PARKSVILLE - QUALICUM COMMUNITY FOUNDATION,"101 691 BEACH RD, QUALICUM BEACH, BC, V9K0A7, CA",49.346911,-124.447472
KOOTENAY ROMANIAN RELIEF ORGANIZATION CANADA,"BOX 652, NELSON, BC, V1L5R4, CA",49.4929207,-117.2938563
SOOKE OPTIONS FOR COMMUNITY LIVING ASSOCIATION,"6580 SOOKE ROAD, SOOKE, BC, V9Z0A7, CA",48.3795324,-123.7173819
FORT NELSON FAMILY DEVELOPMENT SOCIETY,"BOX 1210, 5012 AIRPORT DRIVE, FORT NELSON, BC, V0C1R0, CA",58.8050431,-122.6968073
HRC FOUNDATION,"15569 92 AVE, SURREY, BC, V3R5V9, CA",49.1703827,-122.7910118
FORENSIC PSYCHIATRIC SERVICES COMMISSION,"200 - 1333 BROADWAY W, VANCOUVER, BC, V6H4C1, CA",49.26386979999999,-123.1342545
WEN ZHOU FRIENDSHIP SOCIETY,"4266 HAZELBRIDGE WAY, RICHMOND, BC, V6X0J5, CA",49.1822904,-123.1331651
PEMBERTON VALLEY TRAILS ASSOCIATION,"BOX 282, PEMBERTON, BC, V0N2L0, CA",50.322028,-122.8050498
DOUKHOBOR HERITAGE RETREAT SOCIETY #1999,"PO BOX 3701 STN MAIN, CASTLEGAR, BC, V1N3W4, CA",49.325596,-117.6632938
ANDERTON THERAPEUTIC GARDENS SOCIETY,"PO 1416, COMOX, BC, V9M7Z9, CA",49.701823,-124.9134699
WHITE ROCK PEACE ARCH ROTARY TRUST,"P.O. BOX 45511, SUNYSIDE RPO, SURREY, BC, V4A9N3, CA",49.0455287,-122.785235
EDO FRIENDS OF BRITISH COLUMBIA ASSOCIATION,"13028 109 AVENUE, SURREY, BC, V3T2N5, CA",49.2006282,-122.8612775
CAMPBELL RIVER COMMUNITY FOUNDATION,"P.O. BOX 734, CAMPBELL RIVER, BC, V9W6J3, CA",49.99903,-125.2466009
TREV DEELEY FOUNDATION,"1875 BOUNDARY RD, VANCOUVER, BC, V5M3Y7, CA",49.26784,-123.02486
SUPPORTIVE CARE HOLDINGS SOCIETY,"103 - 2776 BOURQUIN CRES W, ABBOTSFORD, BC, V2S6A4, CA",49.05256809999999,-122.3099753
WISH DROP-IN CENTRE SOCIETY,"334 ALEXANDER ST, VANCOUVER, BC, V6A1C3, CA",49.2838469,-123.0966827
GOLDEN SPADE FOUNDATION,"32509 VERDON WAY, ABBOTSFORD, BC, V2T7Y3, CA",49.0719732,-122.3237509
THE FOUNDATION OF HOPE FOR CHILDREN'S HOSPITALS,"P.O. BOX 73575, VANCOUVER, BC, V6E4L9, CA",49.282905,-123.1305109
SEMIAHMOO PENINSULA MARINE RESCUE SOCIETY,"2286 129B ST, SURREY, BC, V4A7E2, CA",49.04363860000001,-122.8624116
LIGHT AND LOVE HOME,"A-123 6TH AVE E, VANCOUVER, BC, V5T1J6, CA",49.2658719,-123.1023139
DRESS FOR SUCCESS VANCOUVER SOCIETY,"685 HASTINGS ST W, VANCOUVER, BC, V6B1N9, CA",49.2853217,-123.1134011
OKANAGAN SIMILKAMEEN CONSERVATION ALLIANCE,"113 - 437 MARTIN ST, PENTICTON, BC, V2A5L1, CA",49.4958512,-119.5928675
MUSIC FOR LIFE FOUNDATION,"PO BOX 3100 LCD LCD, LANGLEY, BC, V3A4R3, CA",49.1080376,-122.678928
KING GEORGE SENIORS AFFORDABLE HOUSING SOCIETY,"BOX 587, LAKE COWICHAN, BC, V0R2G0, CA",48.8258118,-124.054167
THE ARTHRITIS RESEARCH CENTRE SOCIETY OF CANADA/ARTHRITE-RECHERCHE CANADA,"230 - 2238 YUKON ST, VANCOUVER, BC, V5Y3P2, CA",49.2651104,-123.1125282
NORTH SHORE MOUNTAIN BIKE ASSOCIATION,"PO BOX 16127 RPO LYNN VALLEY, NORTH VANCOUVER, BC, V7J3S9, CA",49.352496,-123.0172359
JACK AND DORIS BROWN FOUNDATION,"1763 38TH AVE W, VANCOUVER, BC, V6M1R7, CA",49.2371758,-123.1460359
SHOWERS OF BLESSING INTERNATIONAL,"36406 CARNARVON COURT, ABBOTSFORD, BC, V3G3G4, CA",49.05422859999999,-122.2170807
VANCOUVER COLLEGE FOUNDATION,"5401 HUDSON ST, VANCOUVER, BC, V6M0C5, CA",49.23675490000001,-123.1360649
VICTORIA CHINESE HERITAGE FOUNDATION,"636 FISGARD ST, VICTORIA, BC, V8W1R5, CA",48.4296876,-123.3658317
DISTRICT OF SQUAMISH MUNICIPAL LIBRARY,"37907 - 2ND AVENUE, P. O. BOX 1039, SQUAMISH, BC, V8B0A7, CA",49.6989762,-123.152538
SOOKE SENIOR DROP IN CENTER,"POSTAL OFFICE BOX 1004, SOOKE, BC, V9Z1J1, CA",48.371519,-123.7275839
NICOLA VALLEY HEALTH CARE AUXILIARY,"BOX 677, MERRITT, BC, V1K1B8, CA",50.1110816,-120.7881949
THE MARGARET ROCHE-HEYWOOD FOUNDATION,"2771 SEAVIEW PLACE, VICTORIA, BC, V8N1K8, CA",48.4558,-123.287
W.I.N.G.S. FELLOWSHIP MINISTRIES,"501 - 104 - 1015 COLUMBIA ST, NEW WESTMINSTER, BC, V3M6V3, CA",49.2012134,-122.9173285
GRAND FORKS AND DISTRICT HOUSING SOCIETY,"7130 9TH STREET, UNIT 200, GRAND FORKS, BC, V0H1H4, CA",49.0286038,-118.4445028
ELIM CHRISTIAN CARE SOCIETY,"9025 160 ST, SURREY, BC, V4N2X7, CA",49.166742,-122.781325
HOUSTON HOSPICE SOCIETY,"3234 BENSON AVE, BOX 385, HOUSTON, BC, V0J1Z0, CA",54.4002711,-126.6522573
Prostate Cancer Foundation BC,"4-17918 55TH AVENUE, SURREY, BC, V3S6C8, CA",49.10195299999999,-122.7262879
SPIRIT ABREAST DRAGON BOAT SOCIETY,"10 - 45160 SOUTH SUMAS RD, CHILLIWACK, BC, V2R3X6, CA",49.1187546,-121.9568191
FORT ST JOHN HOSPITAL AUXILIARY,"10912 96 ST, FORT ST. JOHN, BC, V1J3R7, CA",56.25503,-120.8404753
"SOCIETY OF FRIENDS OF ST ANN'S ACADEMY- VICTORIA, BC","P.O. BOX 9188, 835 HUMBALT ST., VICTORIA, BC, V8W9E6, CA",48.4197374,-123.3628284
INNOVATIVECOMMUNITIES.ORG FOUNDATION,"300 - 722 CORMORANT ST, VICTORIA, BC, V8W1P8, CA",48.4286887,-123.3635521
SOMERSET FOUNDATION,"510-5525 WEST BLVD, VANCOUVER, BC, V6M3W6, CA",49.23612960000001,-123.1557889
FRASER VALLEY HEALTH CARE FOUNDATION,"32900 MARSHALL RD, ABBOTSFORD, BC, V2S0C2, CA",49.0370255,-122.3132768
LADYSMITH AND DISTRICT MARINE RESCUE SOCIETY,"P.O. BOX 657, LADYSMITH, BC, V9G1A5, CA",48.9939001,-123.8194387
CHURCHES OF SALMON ARM USED GOODS SOCIETY,"461 BEATTY AVE NW, SALMON ARM, BC, V1E1W3, CA",50.7009334,-119.2904322
COWICHAN NEIGHBOURHOOD HOUSE ASSOCIATION,"1-9806 WILLOW ST, PO BOX 457, CHEMAINUS, BC, V0R1K0, CA",48.9301648,-123.7344814
MISSY FOUNDATION,"BOX 280, BOWEN ISLAND, BC, V0N1G0, CA",49.3509749,-123.253971
POSABILITIES ASSOCIATION OF BRITISH COLUMBIA,"240 - 4664 LOUGHEED HWY, BURNABY, BC, V5C5T5, CA",49.2653877,-122.9982501
BEING GRATEFUL FOUNDATION,"203 - 815 HORNBY ST, VANCOUVER, BC, V6Z2E6, CA",49.2824313,-123.1225062
ST. JOHN FOUNDATION (BRITISH COLUMBIA AND YUKON),"6111 CAMBIE STREET, VANCOUVER, BC, V5Z3B2, CA",49.2295388,-123.1169454
MAYNE ISLAND CONSERVANCY SOCIETY,"P O BOX 31, MAYNE ISLAND, BC, V0N2J0, CA",48.8311335,-123.3782876
FIRST FUNDS SOCIETY,"2960 NANAIMO ST, VANCOUVER, BC, V5N5G3, CA",49.2574944,-123.0563319
TRUST UNDER THE WILL OF HUGH LATIMER TRENHOLM,"(THE CANADA TRUST CO.), PO BOX 10085, VANCOUVER, BC, V7Y1B6, CA",49.2830972,-123.1175032
MHG FOUNDATION,"2600 - 700 WEST GEORGIA STREET, VANCOUVER, BC, V7Y1B3, CA",49.283704,-123.1169306
SURVIVAL RESEARCH INSTITUTE OF CANADA,"POST OFFICE BOX 8697, VICTORIA, BC, V8W3S3, CA",48.425114,-123.3647699
NORTH SHORE COMMUNITY CENTRE SOCIETY,"730 COTTONWOOD AVENUE, BOX 452, KAMLOOPS, BC, V2B8M6, CA",50.6972576,-120.3645548
B C ABORIGINAL CHILD CARE SOCIETY,"102 - 100 PARK ROYAL SOUTH, WEST VANCOUVER, BC, V7T1A2, CA",49.3252151,-123.1341228
PENDER HARBOUR LIVING HERITAGE SOCIETY,"4334 IRVINES LANDING RD, GARDEN BAY, BC, V0N1S1, CA",49.6376599,-124.05415
CITY CENTRE CARE SOCIETY,"415 WEST PENDER STREET, VANCOUVER, BC, V6B1V2, CA",49.283181,-123.1119543
CLEARWATER AND DISTRICT FOOD BANK SOCIETY,"1-742 CLEARWATER VILLAGE RD, CLEARWATER, BC, V0E1N1, CA",51.646543,-120.011746
SEMIAHMOO COMMUNITY SAFETY SOCIETY,"15299 PACIFIC AVENUE, WHITE ROCK, BC, V4B1R1, CA",49.0231304,-122.7980345
TRUST UNDER THE WILL OF ERICA ELIZABETH HUGHES,"(THE CANADA TRUST CO.), PO BOX 10085, VANCOUVER, BC, V7Y1B6, CA",49.2830972,-123.1175032
THE CIRCLE SALT SPRING EDUCATION SOCIETY,"344 LOWER GANGES ROAD, SALT SPRING ISLAND, BC, V8K2V3, CA",48.8596916,-123.509339
SAANICH PIONEERS' SOCIETY,"7910 POLO PARK CRES, SAANICHTON, BC, V8M2J4, CA",48.5972677,-123.4182655
BRITISH COLUMBIA SOCIETY FOR MALE SURVIVORS OF SEXUAL ABUSE,"3126 BROADWAY W, VANCOUVER, BC, V6K2H3, CA",49.2639807,-123.1747121
COMMUNITY FOUNDATION OF WHISTLER,"P.O. BOX 1184, WHISTLER, BC, V0N1B0, CA",50.0937567,-123.0118768
PEACE ARCH HOSPITAL AUXILIARY SOCIETY,"15521 RUSSELL AVENUE, WHITE ROCK, BC, V4B2R4, CA",49.0297273,-122.7936537
HILDA AND LEWIS D CHIPMAN MEMORIAL FUND,"(THE CANADA TRUST CO.), PO BOX 10085, VANCOUVER, BC, V7Y1B6, CA",49.2830972,-123.1175032
JOHN CLARENCE INMAN MEMORIAL BURSARY,"TD PRIVATE CLIENT SERVICES, PO BOX 10085, VANCOUVER, BC, V7Y1B6, CA",49.2830972,-123.1175032
JOHN VOLKEN ACADEMY SOCIETY,"6911 KING GEORGE BLVD, SURREY, BC, V3W5A1, CA",49.1272949,-122.846695
GIBSONS & DISTRICT LIBRARY FOUNDATION SOCIETY,"PO BOX 109, GIBSONS, BC, V0N1V0, CA",49.4062203,-123.5108797
LII MICHIF OTIPEMISIWAK FAMILY & COMMUNITY SERVICES SOCIETY,"707 TRANQUILLE ROAD, KAMLOOPS, BC, V2B3J1, CA",50.6973958,-120.3617541
TREVOR LINDEN FOUNDATION,"1376 CRAIGDARROCH RD, VICTORIA, BC, V8S2A7, CA",48.4217668,-123.3436777
