Legal name,full_address,Lat,Long
BURNABY HOSPICE SOCIETY,"6855 KINGSWAY, BURNABY, BC, V5E1E4, CA",49.218647,-122.962037
ALOUETTE ADDICTIONS SERVICES SOCIETY,"22477 LOUGHEED HWY, MAPLE RIDGE, BC, V2X2T8, CA",49.2171913,-122.5993101
STEPHEN A. COLEOPY COMMISSIONAIRES BENEVOLENT FUND SOCIETY,"801-595 HOWE STREET, BOX 22, VANCOUVER, BC, V6C2T5, CA",49.2844905,-123.1173474
METCHOSIN PRESCHOOL SOCIETY,"4354 METCHOSIN RD, VICTORIA, BC, V9C3Z4, CA",48.3806038,-123.5309955
SIGNAL HILL LIFE EDUCATION SOCIETY,"PO BOX 45076 RPO LANGLEY, LANGLEY, BC, V2Y0C9, CA",49.1184215,-122.6706946
LYNN VALLEY LIONS HOUSING SOCIETY,"1055 PREMIER ST, NORTH VANCOUVER, BC, V7J3T7, CA",49.3173572,-123.0280287
VANCOUVER ISLAND MILITARY MUSEUM SOCIETY,"100 CAMERON ROAD, NANAIMO, BC, V9R0C8, CA",49.1655105,-123.9345819
BAPTIST HOUSING HALLMARK SOCIETY,"125-6165 HIGHWAY 17A, DELTA, BC, V4K5B8, CA",49.089004,-123.05722
DIXON TRANSITION SOCIETY,"204-2101 HOLDOM AVE, BURNABY, BC, V5B0A4, CA",49.2645259,-122.9822415
LOWER MAINLAND CHRISTMAS BUREAU,"3RD FLOOR-1870 PANDORA ST, VANCOUVER, BC, V5L1M5, CA",49.2829168,-123.0662647
Work Wellness and Disability Prevention Institute / Institutsur le bien-être au travail et la prévention de l'incapacité,"204-916 WEST BROADWAY, VANCOUVER, BC, V5Z1K7, CA",49.26299059999999,-123.1096703
FRIENDS OF WEST KOOTENAY PARK SOCIETY,"P.O. BOX 212, NELSON, BC, V1L5P9, CA",49.4929207,-117.2938563
FRIENDS OF FORT STEELE SOCIETY,"GENERAL DELIVERY, 9851 HIGHWAY 93/95, FORT STEELE, BC, V0B1N0, CA",49.6341767,-115.634304
THOMPSON-NICOLA REGIONAL DISTRICT LIBRARY SYSTEM,"300-465 VICTORIA ST, KAMLOOPS, BC, V2C2A9, CA",50.6755872,-120.3302494
EAST SIDE FAMILY PLACE SOCIETY,"1655 WILLIAM ST, VANCOUVER, BC, V5L2R3, CA",49.2739922,-123.0705385
FAMILY CAREGIVERS SOCIETY OF BRITISH COLUMBIA,"#6-3318 OAK STREET, VICTORIA, BC, V8X1R1, CA",48.4511158,-123.3722182
URBAN NATIVE YOUTH ASSOCIATION,"1618 HASTINGS ST E, VANCOUVER, BC, V5L1S6, CA",49.2811204,-123.0718313
DELTA HOSPITAL AND COMMUNITY HEALTH FOUNDATION,"5800 MOUNTAIN VIEW BLVD, DELTA, BC, V4K3V6, CA",49.0864781,-123.0616951
COBBLE HILL-MILL BAY-SHAWNIGAN LAKE FOOD BANK SOCIETY,"2740 LASHBURN RD, MILL BAY, BC, V0R2P1, CA",48.6528651,-123.5578051
ST BARNABAS DAY CARE SOCIETY,"1005 NAPANEE STREET, NEW WESTMINSTER, BC, V3M5Y2, CA",49.2086359,-122.9236919
LITTLE PRAIRIE HERITAGE SOCIETY,"BOX 1777, WESTGATE ROAD, CHETWYND, BC, V0C1J0, CA",55.7050379,-121.6823515
KIWASSA HOUSING SOCIETY,"2425 OXFORD STREET, VANCOUVER, BC, V5K1M7, CA",49.2859829,-123.0555911
THE HERITAGE BUILDING FOUNDATION OF THE HALLMARK SOCIETY,"15-1594 FAIRFIELD RD PO BOX, 50013 FAIRFIELD PLAZA PO, VICTORIA, BC, V8S1G1, CA",48.41249140000001,-123.3375162
THE KAMLOOPS & DISTRICT SOCIETY FOR PEOPLE IN MOTION,"182B TRANQUILLE ROAD, KAMLOOPS, BC, V2B3G1, CA",50.68523219999999,-120.3549212
DOWNTOWN EASTSIDE WOMEN'S CENTRE ASSOCIATION,"302 COLUMBIA ST, VANCOUVER, BC, V6A4J1, CA",49.2821393,-123.1020496
PACIFIC OTOLARYNGOLOGY FOUNDATION,"P.O. BOX 39131, VANCOUVER, BC, V6R4P1, CA",49.266607,-123.1986289
VERNON JUBILEE HOSPITAL AUXILIARY,"2101 32ND ST, VERNON, BC, V1T5L2, CA",50.2563723,-119.2691167
NORTH OKANAGAN SOCIAL PLANNING SOCIETY,"3105 33 STREET, VERNON, BC, V1T9P7, CA",50.265086,-119.2748618
SENIORS COME SHARE SOCIETY,"15008 26 AVE, SURREY, BC, V4P3H5, CA",49.0488045,-122.8056077
CHILDHOOD CONNECTIONS-OKANAGAN FAMILY & CHILDCARE SOCIETY,"1890 AMBROSI ROAD, UNIT 4, KELOWNA, BC, V1Y4R9, CA",49.8796619,-119.4501434
SOS CHILDREN'S VILLAGE BRITISH COLUMBIA (CANADA) SOCIETY,"302 - 14225 57 AVE, SURREY, BC, V3X0H6, CA",49.1064823,-122.8283249
BEACON COMMUNITY ASSOCIATION,"2723 QUADRA ST, VICTORIA, BC, V8T4E5, CA",48.440049,-123.3590039
EARTHSAVE CANADA,"170 - 422 RICHARDS ST, VANCOUVER, BC, V6B2Z4, CA",49.2836682,-123.1121414
KAMLOOPS ABORIGINAL FRIENDSHIP SOCIETY,"125 PALM STREET, KAMLOOPS, BC, V2B8J7, CA",50.6856222,-120.3564463
ARROW AND SLOCAN LAKES COMMUNITY SERVICES,"PO BOX 100, NAKUSP, BC, V0G1R0, CA",50.2398537,-117.8011055
HERITAGE ABBOTSFORD SOCIETY,"2313 WARE ST, ABBOTSFORD, BC, V2S3C6, CA",49.0435519,-122.3051425
SOUTH OKANAGAN WOMEN IN NEED SOCIETY,"102 - 1027 WESTMINSTER AVE W, PENTICTON, BC, V2A1L4, CA",49.4973657,-119.6051278
THE SOCIETY OF HOUSING OPPORTUNITIES AND PROGRESSIVE EMPLOYMENT,"101-2055 BENVOULIN CRT, KELOWNA, BC, V1W2C7, CA",49.8763215,-119.4391805
ACT II CHILD AND FAMILY SERVICES SOCIETY,"2ND FLOOR, 1034 AUSTIN AVE, COQUITLAM, BC, V3K3P3, CA",49.2488267,-122.8646813
KAMLOOPS FOOD BANK SOCIETY,"PO 1513 STN MAIN, KAMLOOPS, BC, V2C6L8, CA",50.623589,-120.1927869
RICHMOND ADDICTION SERVICES SOCIETY,"105 - 8080 ANDERSON RD, RICHMOND, BC, V6Y0J5, CA",49.16328739999999,-123.1350608
SHUSWAP FAMILY RESOURCE AND REFERRAL SOCIETY,"681 MARINE PARK DR NE, SALMON ARM, BC, V1E2W7, CA",50.7045629,-119.2819875
CO-DEVELOPMENT CANADA ASSOCIATION,"260-2747 E HASTINGS STREET, VANCOUVER, BC, V5K1Z8, CA",49.2813534,-123.0477866
M.O.S.A.I.C. MULTI-LINGUAL ORIENTATION SERVICE ASSOCIATION FOR IMMIGRANT COMMUNITIES,"5575 BOUNDARY RD, VANCOUVER, BC, V5R2P9, CA",49.2335537,-123.0239332
ROYAL ARCH MASONIC HOMES SOCIETY,"7850 CHAMPLAIN CRESCENT, VANCOUVER, BC, V5S4C7, CA",49.21352419999999,-123.028777
NANAIMO REGION JOHN HOWARD SOCIETY,"2353 ROSSTOWN RD, NANAIMO, BC, V9T3R6, CA",49.1961366,-123.9990098
SHUSWAP INDEPENDENT LIVING ASSOCIATION,"PO BOX 3275 STN MAIN, SALMON ARM, BC, V1E4S1, CA",50.7019667,-119.2803042
B.W.S.S.: BATTERED WOMEN'S SUPPORT SERVICES ASSOCIATION,"PO BOX 21503, 1424 COMMERCIAL DRIVE, VANCOUVER, BC, V5L5G2, CA",49.2717299,-123.0693109
OSOYOOS SECONDARY SCHOOL TRANSPORTATION SOCIETY,"5800 115TH ST, OSOYOOS, BC, V0H1V4, CA",49.020421,-119.482364
AUXILIARY TO BURNABY HOSPITAL,"3935 KINCAID ST, BURNABY, BC, V5G2X6, CA",49.2494148,-123.0141251
Vancouver Aboriginal Health Society,"449 EAST HASTINGS STREET,, VANCOUVER, BC, V6A1P5, CA",49.2814816,-123.0942149
DISABLED SAILING ASSOCIATION OF BRITISH COLUMBIA,"318 - 425 CARRALL ST, VANCOUVER, BC, V6B6E3, CA",49.2812047,-123.1046522
NANAIMO TRAVELLERS LODGE SOCIETY,"1917 NORTHFIELD RD, NANAIMO, BC, V9S3B6, CA",49.1911,-123.98382
THE LIVING THROUGH LOSS COUNSELLING SOCIETY OF B.C.,"206-1651 COMMERCIAL DRIVE, VANCOUVER, BC, V5L3Y3, CA",49.2829607,-123.0701954
SHUSWAP AREA FAMILY EMERGENCY SOCIETY,"P.O. BOX 1463 STN MAIN, SALMON ARM, BC, V1E4P6, CA",50.7019667,-119.2803042
FIRST UNITED CHURCH SOCIAL HOUSING SOCIETY,"320 HASTINGS ST E, VANCOUVER, BC, V6A1P4, CA",49.2809976,-123.0970055
STROKE RECOVERY ASSOCIATION OF BRITISH COLUMBIA,"301-1212 BROADWAY W, VANCOUVER, BC, V6H3V1, CA",49.2633141,-123.1316089
DAWSON CREEK MUNICIPAL PUBLIC LIBRARY,"1001 MCKELLAR AVE, DAWSON CREEK, BC, V1G4W7, CA",55.7537441,-120.2349252
CAMERAY COMMUNITY FUND,"102 - 5623 IMPERIAL ST, BURNABY, BC, V5J1G1, CA",49.2222197,-122.9819662
RICHMOND CARING PLACE SOCIETY,"STE 140, 7000 MINORU BLDG, RICHMOND, BC, V6Y3Z5, CA",49.1614308,-123.1397768
PACIFIC YOUTH AND FAMILY SERVICES SOCIETY,"205 - 2735 HASTINGS STREET, VANCOUVER, BC, V5K1Z8, CA",49.2812707,-123.0486315
THE BOAT DAY CARE SOCIETY,"2908 VICTORIA DR, VANCOUVER, BC, V5N4L8, CA",49.2584453,-123.0656034
TRI-CITY TRANSITIONS SOCIETY,"402 - 2071 KINGSWAY AVE, PORT COQUITLAM, BC, V3C6N2, CA",49.2588881,-122.774223
TRANS-HIMALAYAN AID SOCIETY,"1183 MELVILLE ST, VANCOUVER, BC, V6E2X5, CA",49.28763439999999,-123.1234722
WEST SIDE FAMILY PLACE SOCIETY,"2819 WEST 11TH AVENUE, VANCOUVER, BC, V6K2M2, CA",49.26253330000001,-123.1688832
M'AKOLA HOUSING SOCIETY,"104 - 550 GOLDSTREAM AVE, VICTORIA, BC, V9B2W7, CA",48.4463471,-123.4859733
AVI HEALTH & COMMUNITY SERVICES SOCIETY,"3RD FLOOR-713 JOHNSON STREET, VICTORIA, BC, V8W1M8, CA",48.4268867,-123.3639519
THE BRAEFOOT COMMUNITY ASSOCIATION,"1359 MCKENZIE AVENUE, VICTORIA, BC, V8P2M1, CA",48.4710828,-123.3478812
THE VICTORIA FOUNDATION,"200 - 703 BROUGHTON ST, VICTORIA, BC, V8W1E2, CA",48.4236663,-123.3651031
BURNABY SENIORS OUTREACH SERVICES SOCIETY,"5 - 2055 ROSSER AVE, BURNABY, BC, V5C0H1, CA",49.2662488,-123.0064198
KACKAAMIN FAMILY DEVELOPMENT CENTRE ASSOCIATION,"7830 BEAVER CREEK RD, PORT ALBERNI, BC, V9Y8N3, CA",49.3246115,-124.8939297
NELSON KIWANIS PROJECTS SOCIETY,"700 GORDON RD, NELSON, BC, V1L3L8, CA",49.5080651,-117.276604
CREEKVIEW TINY TOTS SOCIETY,"14219 62B AVE, SURREY, BC, V3X0B7, CA",49.1171909,-122.8284256
ALDER GROVE HERITAGE SOCIETY,"3190-271 STREET, ALDERGROVE, BC, V4W3H7, CA",49.0603162,-122.4719451
CHESHIRE HOMES SOCIETY OF BRITISH COLUMBIA,"101A - 3920 NORLAND AVE, BURNABY, BC, V5G4K7, CA",49.2489321,-122.9741824
43 HOUSING SOCIETY,"200-25 KING EDWARD ST, COQUITLAM, BC, V3K4S8, CA",49.231351,-122.8621941
ROTARY CLUB OF LANTZVILLE SOCIETY,"P.O. BOX 502, LANTZVILLE, BC, V0R2H0, CA",49.2506156,-124.075031
BEULAH GARDEN HOMES SOCIETY,"3350 5TH AVE E, VANCOUVER, BC, V5M1P4, CA",49.26540989999999,-123.0320195
CENTRAL CITY MISSION,"JENNIFER JOHNSTONE, 206-304 CORDOVA STREET, VANCOUVER, BC, V6B1E8, CA",49.283244,-123.1090165
LOOKOUT HOUSING AND HEALTH SOCIETY,"544 COLUMBIA ST, NEW WESTMINSTER, BC, V3L1B1, CA",49.2032839,-122.9071948
PRINCE GEORGE FAMILY SERVICES SOCIETY,"205-575 QUEBEC ST, PRINCE GEORGE, BC, V2L1W6, CA",53.917838,-122.7455789
THE IMMIGRANT SERVICES SOCIETY OF BRITISH COLUMBIA,"2610 VICTORIA DR, VANCOUVER, BC, V5N4L2, CA",49.2610006,-123.0653303
SEVA CANADA SOCIETY,"100-2000 WEST 12TH AVENUE, VANCOUVER, BC, V6J2G2, CA",49.2608103,-123.1510332
POWELL RIVER COMMUNITY SERVICES ASSOCIATION,"209 - 6975 ALBERNI ST, POWELL RIVER, BC, V8A2B8, CA",49.8457752,-124.5217494
ALBERNI VALLEY RESCUE SQUAD,"P.O. BOX 1137, PORT ALBERNI, BC, V9Y7L9, CA",49.26792700000001,-124.7858807
CITY FARMER SOCIETY,"PO BOX 74567, KITSILANO RPO, VANCOUVER, BC, V6K4P4, CA",49.26558800000001,-123.1656319
MORE THAN A ROOF MENNONITE HOUSING SOCIETY,"100-1515 CHARLES ST, VANCOUVER, BC, V5L2T2, CA",49.2733916,-123.0731843
STEWART PUBLIC LIBRARY ASSOCIATION,"PO BOX 546, 824 9TH AVENUE, STEWART, BC, V0T1W0, CA",55.9395772,-129.9925958
MAVIS MCMULLEN HOUSING SOCIETY,"430 CORDOVA ST E, VANCOUVER, BC, V6A1L6, CA",49.2820092,-123.0944178
HEALTH AND HOME CARE SOCIETY OF BRITISH COLUMBIA,"204-3077 GRANVILLE ST, (AT 15TH AVE), VANCOUVER, BC, V6H3J9, CA",49.2583073,-123.1391734
POWELL RIVER HOSPITAL FOUNDATION,"3 - 4313 ALBERTA AVE, POWELL RIVER, BC, V8A5G7, CA",49.8319957,-124.5181712
MAPLE RIDGE/PITT MEADOWS COMMUNITY SERVICES,"22718 LOUGHEED HWY, MAPLE RIDGE, BC, V2X2V6, CA",49.2165275,-122.5930038
ROYAL JUBILEE HOSPITAL AUXILLIARY,"1952 BAY STREET, VICTORIA, BC, V8R1J8, CA",48.4321083,-123.3290564
THE FIRST OPEN HEART SOCIETY OF BRITISH COLUMBIA,"1580 PEMBROKE STREET, VICTORIA, BC, V8R1W2, CA",48.4314104,-123.3360153
CREATIVE CENTRE SOCIETY FOR MENTAL WELLNESS,"PO BOX 8000 PMB #146, ABBOTSFORD, BC, V2S6H1, CA",49.0390384,-122.2725525
COQUITLAM KINSMEN HOUSING SOCIETY,"210-1140 AUSTIN AVE, COQUITLAM, BC, V3K3P5, CA",49.24871,-122.85916
SALMO COMMUNITY RESOURCE SOCIETY,"BOX 39, SALMO, BC, V0G1Z0, CA",49.194892,-117.2792769
TRUST UNDER WILL OF F C MANNING,"PO BOX 10085, VANCOUVER, BC, V7Y1B6, CA",49.2830972,-123.1175032
MOUNT BENSON SENIOR CITIZENS HOUSING SOCIETY,"25 CAVAN ST, NANAIMO, BC, V9R2T9, CA",49.1629194,-123.9369463
REVELSTOKE HERITAGE RAILWAY SOCIETY,"PO BOX 3018, REVELSTOKE, BC, V0E2S0, CA",50.998115,-118.195672
TUMOUR FOUNDATION OF BC,"19172 4TH AVENUE, WEST PO, VANCOUVER, BC, V6K4R8, CA",49.2683152,-123.1633415
CALLING FOUNDATION,"SUITE A  3263 BLENHEIM STREET, VANCOUVER, BC, V6L2X7, CA",49.2573811,-123.1792921
AGASSIZ-HARRISON SENIOR CITIZENS' HOUSING SOCIETY,"#10  2008  MCCAFFREY ROAD, AGASSIZ, BC, V0M1A1, CA",49.24124,-121.772717
TRIMBLE AFTER SCHOOL CARE SOCIETY,"2000 TRIMBLE ST., VANCOUVER, BC, V6K3Z4, CA",49.2676336,-123.2041593
THOMPSON RIVERS UNIVERSITY FOUNDATION,"805 TRU WAY, KAMLOOPS, BC, V2C0C8, CA",50.6701383,-120.361569
MARYSVILLE LIONS HOUSING SOCIETY,"916-307TH AVE, MARYSVILLE, BC, V1A3K6, CA",49.630131,-115.952675
ANN DAVIS TRANSITION SOCIETY,"9046 YOUNG RD, CHILLIWACK, BC, V2P4R6, CA",49.1664409,-121.9522391
COLUMBUS CHARITIES ASSOCIATION,"231 - 5589 BYRNE RD, BURNABY, BC, V5J3J1, CA",49.2011847,-122.9845202
ACTIVE SUPPORT AGAINST POVERTY SOCIETY,"1188 6TH AVE, PRINCE GEORGE, BC, V2L3M6, CA",53.91441,-122.745789
THE NATIVE COURTWORKER AND COUNSELLING ASSOCIATION OF BRITISH COLUMBIA,"207-1999 MARINE DR, NORTH VANCOUVER, BC, V7P3J3, CA",49.3233907,-123.1219201
THOMPSON NICOLA FAMILY RESOURCE SOCIETY,"801 MCGILL RD, KAMLOOPS, BC, V2C6R1, CA",50.66779469999999,-120.3610731
CENTRAL OKANAGAN ELIZABETH FRY SOCIETY,"649 LEON AVE, KELOWNA, BC, V1Y9S3, CA",49.8842615,-119.4891047
ALBERNI-CLAYOQUOT CONTINUING CARE SOCIETY,"4200 10TH AVENUE, PORT ALBERNI, BC, V9Y4X3, CA",49.2526506,-124.79852
THE AUXILIARY TO THE LIONS GATE HOSPITAL,"231 E 15TH ST, NORTH VANCOUVER, BC, V7L2L7, CA",49.3208794,-123.068434
KOOTENAY KIDS SOCIETY,"312 SILICA ST, NELSON, BC, V1L4M5, CA",49.4894459,-117.2944751
TOUCHSTONE FAMILY ASSOCIATION,"210 - 3031 VIKING WAY, RICHMOND, BC, V6V1W1, CA",49.1915366,-123.0745892
Jewish Women International Foundation of British Columbia,"106-7580 COLUMBIA STREET, VANCOUVER, BC, V5X4S8, CA",49.2161037,-123.1121921
VALLEY INTEGRATION TO ACTIVE LIVING SOCIETY,"156D GOVERNMENT ST., DUNCAN, BC, V9L1A2, CA",48.7771179,-123.709632
TRAIL FAMILY & INDIVIDUAL RESOURCE CENTRE SOCIETY,"2079 COLUMBIA AVE, TRAIL, BC, V1R1K7, CA",49.0958928,-117.6932818
"CRISIS PREVENTION, INTERVENTION AND INFORMATION CENTRE FOR NORTHERN BC","1600-3RD AVE 5TH FLOOR, PRINCE GEORGE, BC, V2L3G6, CA",53.9190254,-122.751684
CANADIAN MENTAL HEALTH ASSOCIATION OF NORTHERN BC,"1152 THIRD AVE, PRINCE, PRINCE GEORGE, BC, V2L3E5, CA",53.9166058,-122.7436291
THE 127 SOCIETY FOR HOUSING,"1-415 NELSON ST., VANCOUVER, BC, V6B6K6, CA",49.2861945,-123.1332969
LAST DOOR RECOVERY SOCIETY,"#323 - 8TH STREET, NEW WESTMINSTER, BC, V3M3R3, CA",49.20783669999999,-122.9191979
COMMUNITY INTEGRATION SERVICES SOCIETY,"2175 MARY HILL ROAD, PORT COQUITLAM, BC, V3C3A2, CA",49.2556923,-122.7789035
BURNABY VOLUNTEER CENTRE SOCIETY,"153 - 4664 LOUGHEED HWY, BURNABY, BC, V5C5T5, CA",49.2658757,-122.9981843
WESTCOAST FAMILY CENTRES SOCIETY,"101 - 2780 BROADWAY E, VANCOUVER, BC, V5M1Y8, CA",49.261362,-123.0476313
"NORTHERN NATIVE BROADCASTING (TERRACE, B.C.)","4562 QUEENSWAY DR, UNIT B, TERRACE, BC, V8G3X6, CA",54.5127125,-128.5618531
HUBLE HOMESTEAD/GISCOME PORTAGE HERITAGE SOCIETY,"202 1685 3RD AVENUE, PRINCE GEORGE, BC, V2L3G5, CA",53.918619,-122.752508
NANAIMO PARENT PARTICIPATION PRESCHOOL ASSOCIATION,"2290 BOWEN RD, NANAIMO, BC, V9T3K7, CA",49.1945439,-123.9925383
AUXILIARY TO COWICHAN DISTRICT HOSPITAL,"2154E SHAWNIGAN LAKE RD, SHAWNIGAN LAKE, BC, V0R2W5, CA",48.6272532,-123.63344
SANTAS ANONYMOUS SOCIETY,"#2-4320 29TH STREET, VERNON, BC, V1T5B8, CA",50.27612380000001,-119.2709722
VICTORIA CIVIC HERITAGE TRUST,"BOX 8388, VICTORIA, BC, V8W3R9, CA",48.425114,-123.3647699
JOHN HOWARD SOCIETY OF THE THOMPSON REGION,"100 - 529 SEYMOUR ST, KAMLOOPS, BC, V2C0A1, CA",50.6752435,-120.3368743
PLANNED LIFETIME ADVOCACY NETWORK,"205 - 175 BROADWAY E, VANCOUVER, BC, V5T1W2, CA",49.26305199999999,-123.1013092
JOHN HOWARD SOCIETY OF OKANAGAN & KOOTENAY,"1440 ST PAUL ST, KELOWNA, BC, V1Y2E6, CA",49.8877767,-119.4920763
LILLOOET AREA LIBRARY ASSOCIATION,"P.O. BOX 939, LILLOOET, BC, V0K1V0, CA",50.69401569999999,-121.9329594
THE COMOX VALLEY LIFELINE SOCIETY,"392 10TH ST, COURTENAY, BC, V9N1P5, CA",49.6874973,-124.9970135
METRO VANCOUVER CRIME STOPPERS ASSOCIATION,"3585 GRAVELEY ST, VANCOUVER, BC, V5K5J5, CA",49.2707487,-123.0257615
HARO PARK CENTRE SOCIETY,"1233 HARO STREET, VANCOUVER, BC, V6E3Y5, CA",49.2858949,-123.1284209
DAWSON CREEK YOUTH CENTER SOCIETY,"RR 2 SITE 19 COMP 17, DAWSON CREEK, BC, V1G4E8, CA",55.7425387,-120.2211554
BC SPACES FOR NATURE SOCIETY,"BOX 673, GIBSONS, BC, V0N1V0, CA",49.3974171,-123.5152222
CHAN FOUNDATION OF CANADA,"7023 BERKELEY ST, VANCOUVER, BC, V5S2J7, CA",49.2197128,-123.0582506
BRITISH COLUMBIA AVIATION MUSEUM,"1910 NORSEMAN ROAD, NORTH SAANICH, BC, V8L5V5, CA",48.6405355,-123.4214961
KINGHAVEN PEARDONVILLE HOUSE SOCIETY,"31250 KING RD, ABBOTSFORD, BC, V2T6C2, CA",49.03111800000001,-122.3586501
PEMBERTON & DISTRICT PUBLIC LIBRARY,"7390A COTTONWOOD ST, PEMBERTON, BC, V0N2L1, CA",50.3188901,-122.8005668
GABRIOLA ISLAND RECYCLING ORGANIZATION,"700 TIN CAN ALLEY, GABRIOLA, BC, V0R1X3, CA",49.17756869999999,-123.8313667
EVERYWOMAN'S HEALTH CENTRE SOCIETY (1988),"210-2525 COMMERCIAL DRIVE, VANCOUVER, BC, V5N4C1, CA",49.2620111,-123.0701562
HOPE VOLUNTEER SEARCH AND RESCUE GROUP,"BOX 1335, HOPE, BC, V0X1L0, CA",49.379491,-121.4416917
SALMO PUBLIC LIBRARY ASSOCIATION,"BOX 458, SALMO, BC, V0G1Z0, CA",49.194892,-117.2792769
UNION GOSPEL MISSION,"601 E HASTINGS ST, VANCOUVER, BC, V6A1J7, CA",49.2814298,-123.0911838
CENTRAL OKANAGAN NATURALISTS' CLUB,"P.O.BOX 21128, ORCHARD PARK P.O., KELOWNA, BC, V1Y9N8, CA",49.88007959999999,-119.4402434
FRIENDS OF THE BEAVER VALLEY LIBRARY,"BOX 429 1847 1ST ST, FRUITVALE, BC, V0G1L0, CA",49.1129852,-117.5515312
DAWSON CREEK CATHOLIC SOCIAL SERVICES SOCIETY,"PO BOX 156 STN MAIN, DAWSON CREEK, BC, V1G4G3, CA",55.759483,-120.236201
MOUNTAIN MEDICAL SERVICES SOCIETY,"BOX 658, 101-1865 DILWORTH DR, KELOWNA, BC, V1Y9T1, CA",49.880342,-119.4368221
HANS HEALTH ACTION NETWORK SOCIETY,"3 - 1530 7TH AVE W, VANCOUVER, BC, V6J1S3, CA",49.2652565,-123.1395812
SEA TO SKY CRIMESTOPPERS,"P.O. BOX 245, 38030 CLEVELAND AVE, SQUAMISH, BC, V8B0A2, CA",49.6987768,-123.1529483
SHON YEE HOUSING SOCIETY,"628 EAST HASTINGS STREET, VANCOUVER, BC, V6A1R1, CA",49.2809923,-123.0908738
FAMILY DYNAMIX ASSOCIATION,"PO BOX 2289, INVERMERE, BC, V0A1K0, CA",50.5064562,-116.0291433
HEARTBEAT EDUCATIONAL SOCIETY,"PO BOX 98889, 150-351 ABBOTT STREET, VANCOUVER, BC, V6B0M4, CA",49.2825012,-123.1079338
9-10 CLUB - SERVING SOUP TO THE HUNGRY,"740 VIEW STREET, VICTORIA, BC, V8W1J8, CA",48.4254148,-123.3627496
SUNSHINE COAST MUSEUM & ARCHIVES SOCIETY,"BOX 766, GIBSONS, BC, V0N1V0, CA",49.3974171,-123.5152222
BRITISH COLUMBIA CENTRE FOR ABILITY ASSOCIATION,"2805 KINGSWAY, VANCOUVER, BC, V5R5H9, CA",49.2371545,-123.0470547
KOOTENAY LAKE HOSPITAL FOUNDATION,"3 VIEW ST, NELSON, BC, V1L2V1, CA",49.4950249,-117.2848169
ST DAVID'S HOUSE SOCIETY,"1117 51 A ST., DELTA, BC, V4M2Y2, CA",49.023053,-123.081465
NANAIMO F.O.S.NON-PROFIT HOUSING SOCIETY,"#403-1191 SEAFIELD CRESCENT, NANAIMO, BC, V9S4S1, CA",49.18294119999999,-123.9694853
CLEARWATER AND DICTRICT HIGHWAY RESCUE SOCEITY,"1588 OLD NORTH THOMPSON HWY, CLEARWATER, BC, V0E1N2, CA",51.5958601,-120.1178039
THE ZOROASTRIAN SOCIETY OF BRITISH COLUMBIA,"6900 HALIFAX STREET, BURNABY, BC, V5B2R5, CA",49.26775989999999,-122.9609177
BRITISH COLUMBIA ASSOCIATION OF HEALTHCARE AUXILIARIES,"682 MONTCALM RD, TRAIL, BC, V1R2J8, CA",49.0897965,-117.7482688
NANAIMO AFFORDABLE HOUSING SOCIETY,"350 PRIDEAUX STREET, NANAIMO, BC, V9R6Z1, CA",49.1633255,-123.9424266
BRITISH COLUMBIA CRIMINAL JUSTICE ASSOCIATION,"43389 OLD ORCHARD LANE, LINDELL BEACH, BC, V2R0Z4, CA",49.03625719999999,-122.0234473
BULKLEY VALLEY COMMUNITY FOUNDATION,"PO BOX 4584, SMITHERS, BC, V0J2N0, CA",54.782355,-127.1685541
THE VICTORIA CHRISTIAN RETIREMENT SOCIETY,"312-4535 VIEWMONT AVE, VICTORIA, BC, V8Z5L3, CA",48.4959292,-123.3874204
MAYNE ISLAND RECYCLING SOCIETY,"390 CAMPBELL BAY RD, MAYNE ISLAND, BC, V0N2J1, CA",48.8542846,-123.2815667
DOWNTOWN SOCIETY FOR THE FELLOWSHIP OF RECOVERING ALCOHOLICS,"2775 SOPHIA ST., VANCOUVER, BC, V5T3L1, CA",49.2605641,-123.0984775
NICOLA VALLEY MUSEUM ARCHIVES ASSOCIATION,"PO BOX 1262, MERRITT, BC, V1K1B8, CA",50.1110816,-120.7881949
ST GEORGES HOUSING SOCIETY,"101-76 GORGE ROAD WEST, VICTORIA, BC, V9A1M1, CA",48.4466256,-123.395201
BOUNDARY COMMUNITY HOSPICE ASSOCIATION,"BOX 2647, GRAND FORKS, BC, V0H1H0, CA",49.0300946,-118.4451392
FH CANADA,"1 - 31741 PEARDONVILLE ROAD, ABBOTSFORD, BC, V2T1L2, CA",49.0461444,-122.3446782
SALMON ARM MUSEUM AND HERITAGE ASSOCIATION,"PO BOX 1642 STN MAIN, SALMON ARM, BC, V1E4P7, CA",50.6931031,-119.3129377
FRASER NORTH - COMMUNITY VOLUNTEER CONNECTIONS SOCIETY,"1242 WINDSOR AVE, PORT COQUITLAM, BC, V3B7J8, CA",49.2812353,-122.7495923
SURREY FOOD BANK SOCIETY,"1 - 13478 78 AVE, SURREY, BC, V3W8J6, CA",49.1440242,-122.8497039
WEST VANCOUVER COMMUNITY FOUNDATION,"775 15TH ST, WEST VANCOUVER, BC, V7T2S9, CA",49.3312129,-123.157304
BEAUFORT ASSOCIATION FOR INCLUSION IN ACTION,"495 6TH ST, COURTENAY, BC, V9N6V4, CA",49.689532,-125.000731
VGH & UBC HOSPITAL FOUNDATION,"190-855 WEST 12TH AVENUE, VANCOUVER, BC, V5Z1M9, CA",49.2601744,-123.109107
QUALICUM BAY LOW RENTAL HOUSING SOCIETY,"280 LIONS WAY, QUALICUM BEACH, BC, V9K2C3, CA",49.4007058,-124.6332819
LANGLEY FOOD BANK SOCIETY,"5768 203 ST, LANGLEY, BC, V3A1W3, CA",49.1074138,-122.6596088
ROCHE VIEW LODGE SOCIETY,"PO BOX 444, NEW HAZELTON, BC, V0J2J0, CA",55.247553,-127.591578
BRITISH COLUMBIA SERVICE BATTALION SOCIETY (BCSB),"5500 NO.4 ROAD, RICHMOND, BC, V6X3L5, CA",49.1763445,-123.1128101
CRESTON AND DISTRICT SOCIETY FOR COMMUNITY LIVING,"39 13TH AVE S, CRANBROOK, BC, V1C2V4, CA",49.5106395,-115.7637656
WOODGROVE SENIOR CITIZENS HOUSING SOCIETY,"1-3260 NORWELL DR, NANAIMO, BC, V9T1X5, CA",49.2074475,-124.0043242
NECHAKO VIEW SENIOR CITIZENS HOME SOCIETY,"241 NORTHSIDE RD, VANDERHOOF, BC, V0J3A2, CA",54.028096,-124.00704
KELOWNA FAMILY SERVICE CENTRE SOCIETY,"204-347 LEON AVE, KELOWNA, BC, V1Y8C7, CA",49.8843119,-119.4961819
PORT MOODY HERITAGE SOCIETY,"2734 MURRAY ST, PORT MOODY, BC, V3H1X2, CA",49.279283,-122.8508012
Sunshine Coast Healthcare Auxiliary Society,"PO BOX 917, SECHELT, BC, V0N3A0, CA",49.5627453,-123.7532017
SURREY ART GALLERY ASSOCIATION,"13750-88TH AVE, SURREY, BC, V3W3L1, CA",49.1623105,-122.8418998
LEGAL SERVICES SOCIETY,"400-510 BURRARD ST, VANCOUVER, BC, V6C3A8, CA",49.2859668,-123.1175795
AFRICA COMMUNITY TECHNICAL SERVICE SOCIETY,"PO BOX 30044 RPO MONCTON, RICHMOND, BC, V7E0A6, CA",49.125164,-123.1753261
CAMPBELL RIVER CHILD CARE SOCIETY,"394 LEISHMAN RD, CAMPBELL RIVER, BC, V9W3V6, CA",50.0131011,-125.2438329
Société de Saint-Vincent de Paul-Conseil national du Canada Society of Saint-Vincent de Paul-National council of Canada,"805 TAMARACK DR, KELOWNA, BC, V1X1E3, CA",49.8734159,-119.4018777
Société de Saint-Vincent de Paul-Conseil national du Canada Society of Saint-Vincent de Paul-National council of Canada,"1077 FULLER AVE, KELOWNA, BC, V1Y6X6, CA",49.8899491,-119.4777428
Société de Saint-Vincent de Paul-Conseil national du Canada Society of Saint-Vincent de Paul-National council of Canada,"839 SUTHERLAND AVENUE, KELOWNA, BC, V1Y5X4, CA",49.8795426,-119.4842172
Société de Saint-Vincent de Paul-Conseil national du Canada Society of Saint-Vincent de Paul-National council of Canada,"1296 MAIN ST, PENTICTON, BC, V2A5G2, CA",49.4852865,-119.5854441
Société de Saint-Vincent de Paul-Conseil national du Canada Society of Saint-Vincent de Paul-National council of Canada,"16079 88 AVE, SURREY, BC, V4N1G3, CA",49.1632121,-122.7764135
Société de Saint-Vincent de Paul-Conseil national du Canada Society of Saint-Vincent de Paul-National council of Canada,"330 ROYAL AVE, NEW WESTMINSTER, BC, V3L1H8, CA",49.2069547,-122.9076295
Société de Saint-Vincent de Paul-Conseil national du Canada Society of Saint-Vincent de Paul-National council of Canada,"821 FAIRFAX STREET, COQUITLAM, BC, V3J5K7, CA",49.2642033,-122.8546702
Société de Saint-Vincent de Paul-Conseil national du Canada Society of Saint-Vincent de Paul-National council of Canada,"1738 E. HASTINGS STREET, VANCOUVER, BC, V5L1S9, CA",49.2809773,-123.0694188
Société de Saint-Vincent de Paul-Conseil national du Canada Society of Saint-Vincent de Paul-National council of Canada,"315 WALKER ST, COQUITLAM, BC, V3K4C7, CA",49.2408826,-122.8769904
Société de Saint-Vincent de Paul-Conseil national du Canada Society of Saint-Vincent de Paul-National council of Canada,"3645 BENVOULIN RD, KELOWNA, BC, V1W4M7, CA",49.8504306,-119.4654283
Société de Saint-Vincent de Paul-Conseil national du Canada Society of Saint-Vincent de Paul-National council of Canada,"3645 BENVOULIN RD, KELOWNA, BC, V1W4M7, CA",49.8504306,-119.4654283
Société de Saint-Vincent de Paul-Conseil national du Canada Society of Saint-Vincent de Paul-National council of Canada,"33333 MAYFAIR AVENUE, ABBOTSFORD, BC, V2S1P4, CA",49.0403841,-122.3004887
Société de Saint-Vincent de Paul-Conseil national du Canada Society of Saint-Vincent de Paul-National council of Canada,"33260 SHELLEY AVE, ABBOTSFORD, BC, V2S1A5, CA",49.0316862,-122.3027327
Société de Saint-Vincent de Paul-Conseil national du Canada Society of Saint-Vincent de Paul-National council of Canada,"PO BOX 24016, STN NORTHHILLS CTR, KAMLOOPS, BC, V2B1C1, CA",50.6967598,-120.3590867
Société de Saint-Vincent de Paul-Conseil national du Canada Society of Saint-Vincent de Paul-National council of Canada,"20285 DEWDNEY TRUNK ROAD, MAPLE RIDGE, BC, V2X3C9, CA",49.2221439,-122.6584366
Société de Saint-Vincent de Paul-Conseil national du Canada Society of Saint-Vincent de Paul-National council of Canada,"1738 EAST HASTINGS STREET, VANCOUVER, BC, V5L1S9, CA",49.2809773,-123.0694188
Société de Saint-Vincent de Paul-Conseil national du Canada Society of Saint-Vincent de Paul-National council of Canada,"1360 EAST 24TH STREET, NORTH VANCOUVER, BC, V7J1R5, CA",49.3306924,-123.037591
Société de Saint-Vincent de Paul-Conseil national du Canada Society of Saint-Vincent de Paul-National council of Canada,"47-6488 168TH ST, SURREY, BC, V3S8Z1, CA",49.1201991,-122.7562498
Société de Saint-Vincent de Paul-Conseil national du Canada Society of Saint-Vincent de Paul-National council of Canada,"599 SKEENA DRIVE, P.O. BOX 99, MACKENZIE, BC, V0J2C0, CA",55.3420555,-123.0916538
Société de Saint-Vincent de Paul-Conseil national du Canada Society of Saint-Vincent de Paul-National council of Canada,"140 MOODY STREET, PORT MOODY, BC, V3H2P9, CA",49.2748175,-122.8498516
