Legal name,full_address,Lat,Long
PROJECT CHANGE FOUNDATION,"313 - 3880 BROWN RD, WEST KELOWNA, BC, V4T2J5, CA",49.8232586,-119.6295251
LESEA GLOBAL FEED THE HUNGRY,"9-45905 YALE ROAD SUITE 362, CHILLIWACK, BC, V2P8E6, CA",49.1673913,-121.9592633
Veterans Transition Network,"518-470 GRANVILLE ST, VANCOUVER, BC, V6C1V5, CA",49.284723,-123.1142409
PRINCE GEORGE NEW HOPE SOCIETY,"1046 FOURTH AVENUE, PRINCE GEORGE, BC, V2L3J1, CA",53.9152049,-122.7422272
PROVIDENCE PLACE SOCIETY,"7050 RUPERT STREET, BOX 1708, PORT HARDY, BC, V0N2P0, CA",50.7202649,-127.4958439
EGMONT AND DISTRICT VFD SOCIETY,"1662 LANGWORTHY ST, NORTH VANCOUVER, BC, V7K1N5, CA",49.3451208,-123.0260965
F. C. LI FAMILY FOUNDATION,"2839 29TH W AVE, VANCOUVER, BC, V6L1Y2, CA",49.2463457,-123.1690701
SAANICH PENINSULA STROKE RECOVERY ASSOCIATION,"610 SEACLIFFE RD, NORTH SAANICH, BC, V8L5W1, CA",48.614671,-123.472373
GRACE EVERGREEN ACADEMY SOCIETY,"9770 KING GEORGE BOULEVARD, SURREY, BC, V3T2V6, CA",49.1799915,-122.8447345
BEYOND DISABILITY SOCIETY,"203 - 815 HORNBY ST, VANCOUVER, BC, V6Z2E6, CA",49.2824313,-123.1225062
THE R K GRANT FAMILY FOUNDATION,"3045 BEACH DR, VICTORIA, BC, V8R6L3, CA",48.4422282,-123.2936904
VICTORIA COMMUNITY FOOD HUB SOCIETY,"PO BOX 46002, RPO QUADRA VILLAGE, VICTORIA, BC, V8T5G7, CA",48.4507466,-123.3612665
DICK BARR CHARITABLE FOUNDATION,"#200 - 1687 WEST BROADWAY, VANCOUVER, BC, V6J1X2, CA",49.2638699,-123.1429872
VETERANS MEMORIAL RESTORATION SOCIETY,"33812 VICTORY BLVD, ABBOTSFORD, BC, V2S1S6, CA",49.0413691,-122.2873841
THE CAIA CONNECTION,"560 BOBLAW PL, VICTORIA, BC, V9C3Z1, CA",48.35935449999999,-123.5499606
KOOTENAY COLUMBIA EDUCATIONAL HERITAGE SOCIETY,"1300 FRANCES MORAN ROAD, TRAIL, BC, V1R4L9, CA",49.1024342,-117.6988569
WORLD WIDE LIFE HUMANITARIAN PARTNERSHIP SOCIETY,"7 - 1950 BRAEVIEW PL, KAMLOOPS, BC, V1S1R8, CA",50.65009,-120.36558
KOOTENAY PERINATAL SUPPORT SOCIETY,"203 - 815 HORNBY ST, VANCOUVER, BC, V6Z2E6, CA",49.2824313,-123.1225062
SHARE A SMILE SOCIETY,"629 WENTWORTH ST, NANAIMO, BC, V9R3E6, CA",49.1664425,-123.9455943
THE CEDARHURST FOUNDATION,"200-1199 HASTINGS STREET WEST, VANCOUVER, BC, V6E3T5, CA",49.2823629,-123.1099427
CAREAIDAFRICA FOUNDATION,"1800 - 510 GEORGIA ST W, VANCOUVER, BC, V6B0M3, CA",49.2809904,-123.1169992
THE SPRING RIDGE - FERNWOOD COMMUNITY HOUSING LAND TRUST,"1280 BALMORAL RD, VICTORIA, BC, V8T1B5, CA",48.4279905,-123.3462183
VANCOUVER ISLAND SYMPHONY FOUNDATION,"150 COMMERCIAL STREET, NANAIMO, BC, V9R5G6, CA",49.1663574,-123.9366707
CYGNUS FOUNDATION,"203 - 815 HORNBY ST, VANCOUVER, BC, V6Z2E6, CA",49.2824313,-123.1225062
Mealshare Aid Foundation,"1004 - 907 BEACH AVE, VANCOUVER, BC, V6Z2R3, CA",49.2757348,-123.1345752
QUEST UNIVERSITY CANADA FOUNDATION,"3200 UNIVERSITY BOULEVARD, VANCOUVER, BC, V8B0N8, CA",49.7383263,-123.1003742
ANHBC NEIGHBOURHOOD HOUSES FOUNDATION,"203-3102 MAIN ST, VANCOUVER, BC, V5T3G7, CA",49.25724830000001,-123.1008882
STAND AS ONE MINISTRY,"37 - 15454 32 AVE, SURREY, BC, V3Z2J8, CA",49.0598909,-122.7937254
AWE (AGEING WITH EASE IN RURAL COMMUNITIES) SOCIETY,"1601 SEYMOUR ARM BAY ROAD, BOX 71,RR2, SEYMOUR ARM, BC, V0E2V2, CA",51.24856,-118.91735
PANDORA ARTS COLLECTIVE SOCIETY,"10-1921 FERNWOOD RD, VICTORIA, BC, V8T2Y6, CA",48.4301706,-123.3449679
MAMAS FOR MAMAS,"120 - 1735 DOLPHIN AVE, KELOWNA, BC, V1Y8A6, CA",49.878674,-119.459717
TRANSCENDENCE FOUNDATION,"1250-1500 WEST GEORGIA STREET, BOX 62, VANCOUVER, BC, V6G2Z6, CA",49.2900772,-123.1306778
Eugene Bell Canada Foundation,"3821 LISTER STREET, BURNABY, BC, V5G2B9, CA",49.2447948,-123.0191291
RARE DISEASE FOUNDATION,"4500 OAK STREET, ROOM C234, VANCOUVER, BC, V6H3N1, CA",49.2443047,-123.1243029
PHAKAMANI FOUNDATION CANADA,"2968 CLIFFROSE CRES, COQUITLAM, BC, V3E2T2, CA",49.3000285,-122.7940203
ACT WITH AFRICA SOCIETY OF CANADA,"1195 59TH AVE W, VANCOUVER, BC, V6P1Y1, CA",49.2174437,-123.131861
JEAN BEAUMONT FOUNDATION,"3229 7TH AVE W, VANCOUVER, BC, V6K2A3, CA",49.2661314,-123.1766421
SHUGUY MINISTRIES,"670 MORISON AVE, PARKSVILLE, BC, V9P1G3, CA",49.3210065,-124.3358211
FLATROCK COMMUNITY CEMETERY SOCIETY,"2960-242 ROAD, BOX 48, CECIL LAKE, BC, V0C1G0, CA",56.2463482,-120.6467709
ESTIM CHARITABLE TRUST,"3336 RADCLIFFE AVENUE, WEST VANCOUVER, BC, V7V1G6, CA",49.3407729,-123.2086687
HANNAH FOUNDATION,"201-1672 1ST AVE W, VANCOUVER, BC, V6J1G1, CA",49.2703847,-123.1425183
TAAM-UL-MISKIN - HELP THE POOR - CANADA,"3381 PIPER RD, VICTORIA, BC, V9C0G9, CA",48.4260399,-123.5344571
HAIDA GWAII TLUU,"SUITE 400-725 GRANVILLE STREET, VANCOUVER, BC, V7Y1G5, CA",49.2820597,-123.1196942
BURNS LAKE SEARCH AND RESCUE SOCIETY,"556-5TH AVE, BOX 670, BURNS LAKE, BC, V0J1E0, CA",54.2318574,-125.7522155
CANADIAN MEN'S HEALTH FOUNDATION,"900 - 609 HASTINGS ST W, VANCOUVER, BC, V6B4W4, CA",49.2852022,-123.1129049
Praxis Spinal Cord Institute,"6FL-818 10TH AVE W, VANCOUVER, BC, V5Z1M9, CA",49.2620152,-123.1223988
ALBERNI VALLEY CRIME STOPPERS SOCIETY,"4444 MORTON STREET, PORT ALBERNI, BC, V9Y4M8, CA",49.246648,-124.7998846
SOUTH OKANAGAN SIMILKAMEEN VOLUNTEER CENTRE SOCIETY,"102 - 696 MAIN STREET, PENTICTON, BC, V2A5C8, CA",49.493329,-119.5892499
SING FOR YOUR LIFE FOUNDATION,"203-446 WEST AVE, KELOWNA, BC, V1Y4Z2, CA",49.8650831,-119.4930639
OKANAGAN FRUIT TREE PROJECT SOCIETY,"PO BOX 22001 RPO CAPRI CENTRE, KELOWNA, BC, V1Y9N9, CA",49.8816481,-119.4759373
EDEN GLEN FOUNDATION,"1250-1500 GEORGIA W ST, VANCOUVER, BC, V6G2Z6, CA",49.2900772,-123.1306778
CELEBRATE FOUNDATION,"PO BOX 3287 STN MAIN, MISSION, BC, V2V4J4, CA",49.1345575,-122.3049779
PARK HEALTH AND RESEARCH FOUNDATION,"340 CUDMORE RD, SALT SPRING ISLAND, BC, V8K2J6, CA",48.8444718,-123.502763
"FOR ""THE LEAST OF THESE"" MINISTRY","37-6778 TUCELNUIT DRIVE, OLIVER, BC, V0H1T3, CA",49.187226,-119.5382235
A ROCHA CANADA CONSERVATION FOUNDATION,"1620 192 ST, SURREY, BC, V3Z9V2, CA",49.03252550000001,-122.6869564
GIVING BACK SUPPORT RECOVERY SOCIETY,"1425-71 AVENUE WEST, UNIT 308, VANCOUVER, BC, V6P3B6, CA",49.20732479999999,-123.138273
SHUSWAP TRAILRIDER ADAPTIVE ADVENTURE SOCIETY,"90-1361 30 SE ST, SALMON ARM, BC, V1E2N4, CA",50.6907197,-119.2507996
PLAY BETTER FOUNDATION,"203 - 815 HORNBY ST, VANCOUVER, BC, V6Z2E6, CA",49.2824313,-123.1225062
P.H. FOUNDATION OF VANCOUVER,"1524 WEST 65TH AVENUE, VANCOUVER, BC, V6P2R1, CA",49.2120678,-123.1415759
A C WATSON ESTATE ECHO VILLAGE TRUST,"4411 WALLACE ST, PORT ALBERNI, BC, V9Y7Y5, CA",49.2514288,-124.7997189
HEAR AFRICA FOUNDATION,"100-5550 152ND ST, SURREY, BC, V3S5J9, CA",49.10298419999999,-122.7982256
SERVANT PARTNERS FOUNDATION,"203 - 815 HORNBY ST, VANCOUVER, BC, V6Z2E6, CA",49.2824313,-123.1225062
LARRY TELLING FOUNDATION,"905 32 S AVE, CRESTON, BC, V0B1G1, CA",49.084276,-116.4776514
CULTIVATE CANADA SOCIETY,"1800 - 510 GEORGIA ST W, VANCOUVER, BC, V6B0M3, CA",49.2809904,-123.1169992
CENTREPOINT COMMUNITY SERVICES SOCIETY,"24262 60 AVE, LANGLEY, BC, V2Z2G5, CA",49.111002,-122.5520398
AWHSS AFRICAN WOMEN'S HEALTH SERVICES SOCIETY,"4535 KINGSWAY, BURNABY, BC, V5H0E5, CA",49.2298952,-123.0032259
Y.P.HEUNG FOUNDATION,"200 - 1661 WEST 2ND AVE., VANCOUVER, BC, V6J1H3, CA",49.2695751,-123.1448877
WEST VANCOUVER MARINE RESCUE SOCIETY,"4805 MEADFIELD ROAD, WEST VANCOUVER, BC, V7W3E6, CA",49.3445396,-123.2581247
MENINGITISBC.ORG SOCIETY,"20 HALLMAN ST, KITIMAT, BC, V8C2R1, CA",54.0700865,-128.6402382
Scholarship Trust Fund Under the Will of Dr Marial Mosher Estate,"(THE CANADA TRUST CO.), PO BOX 10085, VANCOUVER, BC, V7Y1B6, CA",49.2830972,-123.1175032
STEPPING STONES RECOVERY HOUSE FOR WOMEN SOCIETY,"1571 BURGESS RD, COURTENAY, BC, V9N5R8, CA",49.6764199,-125.0093162
IF NATIONAL INSTITUTE OF FAMILIES FOUNDATION FOR CHILD & YOUTH MENTAL HEALTH,"1433 MCNAIR DR, NORTH VANCOUVER, BC, V7K1X4, CA",49.3533334,-123.0336043
ACCESS PRO BONO SOCIETY OF BRITISH COLUMBIA,"300-845 CAMBIE ST, VANCOUVER, BC, V6B4Z9, CA",49.2777162,-123.1162121
ST. STEPHEN'S TRUST SOCIETY,"104-9710 SECOND STREET, SIDNEY, BC, V8L3C4, CA",48.6470991,-123.3968609
FALCON FOUNDATION,"1631 DICKSON AVENUE, SUITE 1700, KELOWNA, BC, V1Y0B5, CA",49.8802064,-119.4613654
THE GOOD SOUP TRUCK SOCIETY,"837 BURDETT AVE, VICTORIA, BC, V8W1B3, CA",48.4216332,-123.3617853
RECONCILIATION CANADA - A NEW WAY FORWARD SOCIETY,"SUITE 206-1999 MARINE DRIVE, NORTH VANCOUVER, BC, V7P3J3, CA",49.3235007,-123.122041
Watsa Family Foundation,"2900 - 550 BURRARD ST, VANCOUVER, BC, V6C0A3, CA",49.285784,-123.1182076
ONE MORE TIME,"216-67 MINER STREET, NEW WESTMINSTER, BC, V3L5N5, CA",49.21848,-122.89703
BABYGOROUND HELPING FAMILIES SOCIETY,"3461 7TH AVE W, VANCOUVER, BC, V6R1W2, CA",49.2662536,-123.1813216
IRENE COOPER EDUCATIONAL TRUST,"109 - 1633 HILLSIDE AVE, VICTORIA, BC, V8T2C4, CA",48.44497,-123.33436
PAT-MOS FOUNDATION,"203 - 815 HORNBY ST, VANCOUVER, BC, V6Z2E6, CA",49.2824313,-123.1225062
FIRST STEPS HEALTH SOCIETY,"3260 W 5TH AVE, VANCOUVER, BC, V6K1V4, CA",49.26742369999999,-123.1769978
COMMUNITY FOUNDATION OF CASTLEGAR & DISTRICT,"PO BOX 3725, CASTLEGAR, BC, V1N3W4, CA",49.325596,-117.6632938
BEFIT VICTORIA SOCIETY,"800 - 730 VIEW ST, VICTORIA, BC, V8W3Y7, CA",48.42556,-123.36385
PACIFIC AUTISM FAMILY CENTRE FOUNDATION,"405-1015 BURRARD ST, VANCOUVER, BC, V6Z1Y5, CA",49.2871549,-123.1178431
GLOBAL PEDIATRIC ENDOCRINOLOGY AND DIABETES ASSOCIATION,"334 - 3381 CAMBIE ST, VANCOUVER, BC, V5Z4R3, CA",49.2552536,-123.1154207
AL-KAWTHAR FOUNDATION,"203 - 815 HORNBY ST, VANCOUVER, BC, V6Z2E6, CA",49.2824313,-123.1225062
PHILADELPHIA FOUNDATION,"203 - 815 HORNBY ST, VANCOUVER, BC, V6Z2E6, CA",49.2824313,-123.1225062
YAEL'S INDABA CHARITABLE INITIATIVE SOCIETY,"460 - 745 THURLOW ST, VANCOUVER, BC, V6E0C5, CA",49.28533669999999,-123.124457
GMR FOUNDATION,"104 EAST 5TH STREET, SUITE 100, NORTH VANCOUVER, BC, V7L1L5, CA",49.31508119999999,-123.0748514
LOTUS OUTREACH SOCIETY CANADA,"UNIT 120, 9101 HORNE STREET, BURNABY, BC, V3N4M3, CA",49.2500344,-122.9037484
THE WICKERSON FOUNDATION,"2680 ROSEBERY AVE, WEST VANCOUVER, BC, V7V3A2, CA",49.344425,-123.1876561
DELTA FISHING HERITAGE SOCIETY,"4515 RIVER ROAD WEST, DELTA, BC, V4K1R9, CA",49.08825299999999,-123.0987521
NEW MARKET FUNDS SOCIETY,"90 - 425 CARRALL ST, VANCOUVER, BC, V6B6E3, CA",49.281136,-123.104718
METRO VANCOUVER DREAM CENTRE SOCIETY,"726 TWELFTH ST, NEW WESTMINSTER, BC, V3M4J9, CA",49.209927,-122.9336664
SHIFA MINISTRIES,"7898 ISLAND HWY, BLACK CREEK, BC, V9J1G5, CA",49.816489,-125.1190853
KOOTENAY CAMP RETREAT (2008) FOUNDATION,"1800 - 510 GEORGIA ST W, VANCOUVER, BC, V6B0M3, CA",49.2809904,-123.1169992
CANUCKS AUTISM NETWORK SOCIETY,"1788 8TH AVE W, VANCOUVER, BC, V6J1V6, CA",49.2645274,-123.1454052
VIADUCT FOUNDATION,"2637 TURRET  CRES, COQUITLAM, BC, V3E1R5, CA",49.2900029,-122.8121946
TELEPHONE PIONEERS AMATEUR RADIO CLUB,"921 ANDERS ROAD, WEST KELOWNA, BC, V1Z1K2, CA",49.8600551,-119.5528828
DAVID ASH FAMILY FOUNDATION,"415-15225 104 AVE, SURREY, BC, V3R6Y8, CA",49.1918211,-122.8003077
ELLIOTT FAMILY 2011 FOUNDATION,"705-77 WALTER HARDWICK AVE, VANCOUVER, BC, V5Y0C6, CA",49.27102439999999,-123.1057567
OKANAGAN GLOBAL GATEWAY FOUNDATION,"PO BOX 974, OLIVER, BC, V0H1T0, CA",49.1823264,-119.550428
13TH MAN FOUNDATION,"10TH - 1333 BROADWAY W, VANCOUVER, BC, V6H4C1, CA",49.2638752,-123.134265
DR. ANN WORTH CHARITABLE FOUNDATION,"PO BOX 10083 LCD PACIFIC, VANCOUVER, BC, V7Y1B6, CA",49.2767905,-123.1321459
WILSON 5 FOUNDATION,"#600-21 WATER STREET, VANCOUVER, BC, V6B1A1, CA",49.28377039999999,-123.1041064
THE MOUNT CHEAM LIONS CHARITABLE SOCIETY,"PO BOX 249 MAIN STN, CHILLIWACK, BC, V2P6J1, CA",49.1702588,-121.9560795
VICTORY COMMUNITY DEVELOPMENT SOCIETY,"UNIT 99  16655 64 AV, SURREY, BC, V3S3V1, CA",49.1191782,-122.7618975
GAYLA & JOHN DEHART FAMILY FOUNDATION,"PO BOX 18015 RPO KERRISDALE, VANCOUVER, BC, V6M4L3, CA",49.23484699999999,-123.1448229
RACHAM INTERNATIONAL CHARITABLE ASSOCIATION,"PO BOX 2404 STN A, ABBOTSFORD, BC, V2T4X3, CA",49.038448,-122.3562199
SEEDS OF LOVE AND HOPE INTERNATIONAL SOCIETY,"12564 251 ST, MAPLE RIDGE, BC, V4R1S4, CA",49.23136,-122.52503
NEW GENERATION HAITI (CANADA) MINISTRIES,"PO BOX 144 STN MILNER, LANGLEY, BC, V2Y0W9, CA",49.126881,-122.6234425
Gabriola Island Lions Foundation,"PO BOX 261, GABRIOLA, BC, V0R1X0, CA",49.1270238,-123.7774673
Ames Family Foundation,"301 - 415 BOYNE ST, NEW WESTMINSTER, BC, V3M5K2, CA",49.1942831,-122.9416526
VELOO FOUNDATION,"1800-510 WEST GEORGIA STREET, VANCOUVER, BC, V6B0M3, CA",49.2809904,-123.1169992
ROSEWOOD CHARITABLE FOUNDATION,"203 - 815 HORNBY ST, VANCOUVER, BC, V6Z2E6, CA",49.2824313,-123.1225062
CITYGATE LEADERSHIP FORUM SOCIETY,"431 PRINCESS AVE, VANCOUVER, BC, V6A3C9, CA",49.2806604,-123.0916855
DELICATE BALANCE FOUNDATION,"1250-1500 GEORGIA W ST, BOX 62, VANCOUVER, BC, V6G2Z6, CA",49.2857341,-123.1231553
WORLD HOUSING FOUNDATION,"106 - 1008 BEACH AVE, VANCOUVER, BC, V6E1T7, CA",49.2757038,-123.1349918
NORTH STAR HOSPICE SOCIETY,"203 - 815 HORNBY ST, VANCOUVER, BC, V6Z2E6, CA",49.2824313,-123.1225062
RICK'S HEART FOUNDATION,"13350 COMBER WAY, SURREY, BC, V3W5V9, CA",49.1357717,-122.8539499
ADAM PAUL DURAKOVIC FOUNDATION,"100 - 631 CARNARVON ST, NEW WESTMINSTER, BC, V3M1E3, CA",49.2039114,-122.9100949
WHAT IF FOUNDATION,"203 - 815 HORNBY ST, VANCOUVER, BC, V6Z2E6, CA",49.2824313,-123.1225062
RIVER CITY SQUASH ORGANIZATION,"214 MONASHEE PLACE, KAMLOOPS, BC, V2C6B5, CA",50.6664603,-120.3422136
THE NORTHEAST REGIONAL COMMUNITY FOUNDATION,"904-102ND AVENUE, DAWSON CREEK, BC, V1G2B7, CA",55.7580936,-120.2265343
COHA FOUNDATION,"202-1456 ST. PAUL STREET, KELOWNA, BC, V1Y2E6, CA",49.8874404,-119.4920769
TRUST UNDER THE WILL OF J. MURRAY BECK-FLORENCE L. BECK TRUST FUND,"(THE CANADA TRUST CO.), PO BOX 10085, VANCOUVER, BC, V7Y1B6, CA",49.2830972,-123.1175032
VERNON LIVE WELL CLINIC FOR SEXUAL HEALTH AND PREGNANCY ASSOCIATION,"3504 30 ST, VERNON, BC, V1T5E8, CA",50.268057,-119.2710271
THE TRUDY AND DOUG PEDEN CHARITABLE FOUNDATION,"509-612 VIEW STREET, VICTORIA, BC, V8W1J5, CA",48.4258136,-123.3670063
A C WATSON ESTATE FIR PARK VILLAGE TRUST,"4411 WALLACE ST, PORT ALBERNI, BC, V9Y7Y5, CA",49.2514288,-124.7997189
THE VENEMA FOUNDATION,"34761 MT BLANCHARD DR, ABBOTSFORD, BC, V2S2Y2, CA",49.062617,-122.2617572
YOUTH WITH A MISSION FOUNDATION,"PO BOX 57100 RPO EAST, VANCOUVER, BC, V5K5G6, CA",49.281654,-123.0384859
HOSPICE SOCIETY OF THE COLUMBIA VALLEY,"BOX 925, INVERMERE, BC, V0A1K0, CA",50.5064562,-116.0291433
The Amir and Yasmin Virani Family Foundation,"2701-277 THURLOW STREET, VANCOUVER, BC, V6C0C1, CA",49.2889073,-123.1190487
REACH CHILD AND YOUTH DEVELOPMENT CHARITABLE FOUNDATION,"5050 47 AVE, DELTA, BC, V4K0C8, CA",49.0880853,-123.0836251
POLICE ATHLETIC LEAGUE (PAL),"3585 GRAVELEY ST., VANCOUVER, BC, V5K5J5, CA",49.2707487,-123.0257615
THE HELPALITTLE FOUNDATION,"6160 EASTMONT DRIVE, WEST VANCOUVER, BC, V7W1X3, CA",49.362535,-123.2831188
SORRENTO AND AREA COMMUNTIY HEALTH CENTRE SOCIETY,"POST OFFICE BOX 193, SORRENTO, BC, V0E2W0, CA",50.85387530000001,-119.5326305
JB HEART TO HEART FOUNDATION,"125-20449 66 AVE, LANGLEY, BC, V2Y3C1, CA",49.12335700000001,-122.6560191
WEST KOOTENAY COMMUNITY TEETH CLINIC SOCIETY,"632 FRONT ST, NELSON, BC, V1L4B7, CA",49.495099,-117.293288
THE COLIN & LOIS PRITCHARD FOUNDATION,"394 - 2365 STILLINGFLEET RD, KELOWNA, BC, V1W4X5, CA",49.8679719,-119.4679764
DENMAN HEALTH CENTRE SOCIETY,"4265 EAST ROAD, DENMAN ISLAND, BC, V0R1T0, CA",49.50388599999999,-124.7318716
SHRINERS OF BRITISH COLUMBIA & YUKON CHILD SERVICES SOCIETY,"102 - 4238 LOZELLS AVE, BURNABY, BC, V5A0C4, CA",49.2462818,-122.9410877
HANA MISSION SOCIETY,"55 - 16061 85 AVE, SURREY, BC, V4N4Y5, CA",49.1579934,-122.776593
THE ARTS CLUB OF VANCOUVER THEATRE FOUNDATION,"203 - 162 1ST AVE W, VANCOUVER, BC, V5Y0H6, CA",49.27035129999999,-123.1097626
THRIVE ALIVE FOUNDATION,"2782 TRINITY STREET, VANCOUVER, BC, V5K1E7, CA",49.28945239999999,-123.0473686
GLOBAL VOLUNTEER EXPERIENCE FOUNDATION,"203 - 815 HORNBY ST, VANCOUVER, BC, V6Z2E6, CA",49.2824313,-123.1225062
TANTALUS WELLSPRING SOCIETY,"P.O. BOX 3664, 7601 PARADISE VALLEY ROAD, GARIBALDI HIGHLANDS, BC, V0N1T0, CA",49.8318101,-123.1500094
CANADIAN ANIMAL ASSISTANCE TEAM (CAAT),"312 - 270 3RD ST W, NORTH VANCOUVER, BC, V7M1G1, CA",49.31662069999999,-123.0835592
LOOKOUT FOUNDATION,"544 COLUMBIA ST, NEW WESTMINSTER, BC, V3L1B1, CA",49.2032839,-122.9071948
GABRIOLA HOUSING SOCIETY,"2100 SOUTH RD, GABRIOLA, BC, V0R1X6, CA",49.1302379,-123.7610021
SURREY MEMORIAL HOSPITAL AUXILIARY,"13750 96 AVE, SURREY, BC, V3V1Z2, CA",49.1759387,-122.8433034
Dr. Woo Hon Fai Memorial Foundation,"418 - 88 PENDER ST E, VANCOUVER, BC, V6A3X3, CA",49.2833842,-123.113133
TRUE NORTH HELPING HANDS SOCIETY,"7485 SALISBURY AVE, BURNABY, BC, V5E3A5, CA",49.2152658,-122.9574185
MISSION SENIORS CENTRE ASSOCIATION,"33100 10TH AVE, MISSION, BC, V2V2K4, CA",49.1424294,-122.3065704
BLOSSOMS CHARITABLE SOCIETY,"3350 EAST 5TH AVENUE, VANCOUVER, BC, V5M1P4, CA",49.26540989999999,-123.0320195
ONCORE SENIORS SOCIETY,"760 MAYFAIR ST, KAMLOOPS, BC, V2B0E5, CA",50.6985609,-120.3985552
O.E. SMITH TRUST,"TD PRIVATE CLIENT SERVICES, PO BOX 10085, VANCOUVER, BC, V7Y1B6, CA",49.2830972,-123.1175032
PADANG RELIEF SOCIETY,"10-1025 QUEENS AVE, NEW WESTMINSTER, BC, V3M1M4, CA",49.20342,-122.92053
Cheakamus Foundation for Environmental Learning,"2121 LONSDALE AVENUE, NORTH VANCOUVER, BC, V7M2K6, CA",49.3291934,-123.0726507
LOCHMADDY FOUNDATION,"700-200 BURRARD ST, VANCOUVER, BC, V6C3L6, CA",49.2877944,-123.1151763
WORKING GEAR CLOTHING SOCIETY,"PO BOX 88495 RPO CHINATOWN, VANCOUVER, BC, V6A4A7, CA",49.278396,-123.0907039
FIRST UNITED CHURCH COMMUNITY MINISTRY SOCIETY,"320 HASTINGS ST E, VANCOUVER, BC, V6A1P4, CA",49.2809976,-123.0970055
PARAKLESIS FOUNDATION,"1250 - 1500 WEST GEORGIA ST, BOX 62, VANCOUVER, BC, V6G2Z6, CA",49.2900772,-123.1306778
THE HENRY AND GERTRUDE SAWATZKY FAMILY FOUNDATION INC.,"284 QUILCHENA DRIVE, KELOWNA, BC, V1W4Y9, CA",49.79,-119.52218
Lakes District Fall Fair,"8898 COLLEYMOUNT RD, BURNS LAKE, BC, V0J1E2, CA",54.0549911,-125.9002873
MERCY TECH MISSION,"POST OFFICE BOX 1153, SUMMERLAND, BC, V0H1Z0, CA",49.603236,-119.6834179
COMOX BAY CARE SOCIETY,"2800 CLIFFE AVENUE, COURTENAY, BC, V9N2L7, CA",49.6737756,-124.9806243
BORDERLINE PERSONALITY DISORDER SOCIETY OF BRITISH COLUMBIA,"837 BRADLEY DYNE RD, NORTH SAANICH, BC, V8L5G8, CA",48.638422,-123.465244
PACIFIC AUTISM FAMILY CENTRE SOCIETY,"405-1015 BURRARD STREET, VANCOUVER, BC, V6Z1Y5, CA",49.2871549,-123.1178431
OUR PLACE SOCIETY,"919 PANDORA AVE, VICTORIA, BC, V8V3P4, CA",48.4270076,-123.357608
PATHFINDER PARTNERS' FOUNDATION,"1320 - 885 WEST GEORGIA STREET, VANCOUVER, BC, V6C3E8, CA",49.2840167,-123.1190854
BAPTIST HOUSING OAK BAY CARE SOCIETY,"125-6165 HIGHWAY 17A, DELTA, BC, V4K5B8, CA",49.089004,-123.05722
CHAMP FOUNDATION,"203 - 815 HORNBY ST, VANCOUVER, BC, V6Z2E6, CA",49.2824313,-123.1225062
TRIGEMINAL NEURALGIA ASSOCIATION OF CANADA 2006,"8352 208B ST, LANGLEY, BC, V2Y0A7, CA",49.15431,-122.64406
The Well of Silence No More Foundation,"BOX 62, 1250-1500 W. GEORGE STREET, VANCOUVER, BC, V6G2Z6, CA",49.2394828,-123.0949628
GIVE A LITTLE SOCIETY,"1250-1500 GEORGIA W ST, BOX 62, VANCOUVER, BC, V6G2Z6, CA",49.2857341,-123.1231553
BARRIERE & DISTRICT FOOD BANK SOCIETY,"4748 GILBERT ROAD, PO BOX 465, BARRIERE, BC, V0E1E0, CA",51.1824784,-120.1237108
MOON GATE FOUNDATION,"203 - 815 HORNBY ST, VANCOUVER, BC, V6Z2E6, CA",49.2824313,-123.1225062
THE SHEWAN FOUNDATION,"111 20434 64 AVENUE, LANGLEY, BC, V2Y1N4, CA",49.1184501,-122.6568461
H.I.M. HEALTH INITIATIVE FOR MEN SOCIETY,"SUITE 310 - 1033 DAVIE STREET, VANCOUVER, BC, V6E1M7, CA",49.27982859999999,-123.129938
KILLARNEY FOUNDATION,"6260 KILLARNEY STREET, VANCOUVER, BC, V5S2X7, CA",49.22741,-123.04439
UMBRELLA MULTICULTURAL HEALTH COOPERATIVE,"715 CARNARVON ST, NEW WESTMINSTER, BC, V3M1E6, CA",49.2030228,-122.9112192
THE STEELE FAMILY FOUNDATION,"8400 KALVIEW DR, COLDSTREAM, BC, V1B1W7, CA",50.2272334,-119.2864931
STIGMA-FREE SOCIETY,"102 - 245 ROSS DR, NEW WESTMINSTER, BC, V3L0C6, CA",49.21512999999999,-122.90007
NATIONAL HEALTH AND FITNESS FOUNDATION/FONATION NATIONALE POUR LA SANTÉ ET LE CONDITIONNEMENT PHYSIQUE,"203 - 815 HORNBY ST, VANCOUVER, BC, V6Z2E6, CA",49.2824313,-123.1225062
BOFFO FOUNDATION,"1391 VENABLES STREET, VANCOUVER, BC, V5L2G1, CA",49.2769844,-123.0754554
NANAIMO SCIENCE AND SUSTAINABILITY SOCIETY,"PO BOX 37020 RPO COUNTRY, NANAIMO, BC, V9T6N4, CA",49.214089,-124.0631219
MYAN-AFRICAN CHARITY HOUSE,"202 - 1277 GORDON DR, KELOWNA, BC, V1Y4W4, CA",49.8812163,-119.4771039
BARIC FOUNDATION,"2213 SORRENTO DRIVE, COQUITLAM, BC, V3K6H6, CA",49.2381647,-122.8325
URBAN SPIRIT FOUNDATION,"108-100 PARK ROYAL, WEST VANCOUVER, BC, V7T1A2, CA",49.3251879,-123.1336447
CANADIAN HARD OF HEARING ASSOCIATION VANCOUVER BRANCH,"2005 QUEBEC ST, VANCOUVER, BC, V5T2Z6, CA",49.2671377,-123.1030028
TWO WORLDS CANCER COLLABORATION FOUNDATION,"403 - 2901 ABBOTT ST, KELOWNA, BC, V1Y1G7, CA",49.8641511,-119.4945232
MARGARET ROTHWEILER CHARITABLE FOUNDATION,"104-3989 HENNING DRIVE, BURNABY, BC, V5C6N5, CA",49.2642919,-123.0166462
Be Your Promise.Org,"18 - 50 DALLAS RD, VICTORIA, BC, V8V1A2, CA",48.42109010000001,-123.384935
LEON JUDAH BLACKMORE FOUNDATION,"313-619 MOBERLY ROAD, VANCOUVER, BC, V5Z4B1, CA",49.268349,-123.1179897
THE TAM FOUNDATION,"201-745 WEST BROADWAY, VANCOUVER, BC, V5Z1J6, CA",49.26357429999999,-123.1209694
SPARWOOD SEARCH & RESCUE SOCIETY,"705 DOUGLAS FIR RD, BOX 228, SPARWOOD, BC, V0B2G0, CA",49.7145632,-114.8944587
BRITISH COLUMBIA LYMPHEDEMA ASSOCIATION,"723 DONEGAL PL, NORTH VANCOUVER, BC, V7N2X6, CA",49.3402732,-123.0896082
NEW REALITY INTERNATIONAL,"5462 ELLIOT LAKE RD, 100 MILE HOUSE, BC, V0K2E1, CA",51.7032199,-121.3263387
KARE MALAWI SOCIETY,"6400 CROWN DRIVE, PRINCE GEORGE, BC, V2K2G1, CA",53.98748699999999,-122.7959177
CHARIS GOOD NEWS FOUNDATION,"225 - 9600 CAMERON STREET, BURNABY, BC, V3J7N3, CA",49.253077,-122.8982355
THE HIEROS FOUNDATION,"2 - 5110 ALDERFEILD PL, WEST VANCOUVER, BC, V7W2W7, CA",49.3473812,-123.2549216
Ghana Medical Help,"3740 BELAIRE DR, NANAIMO, BC, V9T5A1, CA",49.2213856,-123.9611889
MENTAL HEALTH RECOVERY PARTNERS SOCIETY NORTH ISLAND,"POST OFFICE BOX 651, 850E-12TH AVENUE, CAMPBELL RIVER, BC, V9W6J3, CA",50.02724870000001,-125.2531406
VICTORIA RESTORATIVE JUSTICE SOCIETY,"1933 LEE AVENUE, VICTORIA, BC, V8R4W9, CA",48.4309342,-123.3252741
SCIENCE TO ALL CHARITABLE SOCIETY,"1544 SCARLET HILL ROAD, NANAIMO, BC, V9T1J3, CA",49.2094508,-123.9732799
HUI Family Charitable Foundation,"1343 33RD AVE W, VANCOUVER, BC, V6M1A6, CA",49.2420116,-123.1357329
THE CAWSTON COMMUNITY HALL SOCIETY,"2119 MAIN STREET, CAWSTON, BC, V0X1C1, CA",49.17978859999999,-119.760289
MOM TO MOM CHILD POVERTY INITIATIVE SOCIETY,"500 - 610 MAIN ST, VANCOUVER, BC, V6A2V3, CA",49.2793074,-123.099343
DONNA SCHMIDT LUNG CANCER PREVENTION SOCIETY,"235 FAIRVIEW DR, CASTLEGAR, BC, V1N3S8, CA",49.2390992,-117.6721644
ASIAN CANADIAN CANCER FELLOWSHIP ASSOCIATION,"613 THOMPSON AVE, COQUITLAM, BC, V3J3Z9, CA",49.2686402,-122.8868195
COMMUNITY DENTAL ACCESS CENTRE (NORTH OKANAGAN) SOCIETY,"3107C 31 AVE, VERNON, BC, V1T2G9, CA",50.2647208,-119.2730368
CASTLEGAR SCULPTUREWALK SOCIETY,"PO BOX 3586 STN MAIN, CASTLEGAR, BC, V1N3W3, CA",49.325596,-117.6632938
SHUKHAR PHILANTHROPIC FOUNDATION,"3949 NITHSDALE STREET, BURNABY, BC, V5G1P5, CA",49.2520469,-123.0167368
GRIST MILL FOUNDATION,"2691 UPPER BENCH RD, KEREMEOS, BC, V0X1N4, CA",49.2139088,-119.8075102
PARKSIDE ACADEMY SOCIETY,"6671 BEAUMONT AVE, DUNCAN, BC, V9L5X8, CA",48.8134026,-123.6103218
ALBERNI VALLEY ASSISTED LIVING SOCIETY,"436 HERITAGE LANE, PORT ALBERNI, BC, V9Y4X3, CA",49.2516106,-124.7982734
LANGARA COLLEGE FOUNDATION,"100 WEST 49TH AVENUE, VANCOUVER, BC, V5Y2Z6, CA",49.224025,-123.108032
CHILLIWACK FIRE FIGHTERS CHARITABLE SOCIETY,"45950B CHEAM AVENUE, CHILLIWACK, BC, V2P1N6, CA",49.1664268,-121.9531395
WERTZ FAMILY FOUNDATION,"1500 W. GEORGIA ST., 1250, BOX 62, VANCOUVER, BC, V6G2Z6, CA",49.2900772,-123.1306778
OAK TREE FOUNDATION,"201-3550 MT LEHMAN RD, ABBOTSFORD, BC, V4X2M9, CA",49.0664048,-122.3804402
COMPASSION GLOBALLY SOCIETY,"1500 WEST GEORGIA STREET, SUITE 1250, POST OFFICE BOX 62, VANCOUVER, BC, V6G2Z6, CA",49.2900772,-123.1306778
JEWISH ADDICTION COMMUNITY SERVICES OF VANCOUVER,"200 - 950 41ST AVE W, VANCOUVER, BC, V5Z2N7, CA",49.23339960000001,-123.126628
LARKSPUR FOUNDATION,"6574 MAPLE STREET, VANCOUVER, BC, V6P5P2, CA",49.2262922,-123.1519605
R & J STERN FAMILY FOUNDATION,"SUITE 2900  PO BOX 11583, 650 WEST GEORGIA ST., VANCOUVER, BC, V6B4N8, CA",49.2818976,-123.1179129
MCEWEN FAMILY CHARITABLE TRUST,"4033 HESSINGTON PL, VICTORIA, BC, V8N5C5, CA",48.4733056,-123.3080903
CANADIAN HIMALAYAN ASSOCIATION FOR INNOVATION,"1128 24TH AVENUE EAST, VANCOUVER, BC, V5V2B2, CA",49.2489381,-123.0812116
ALAN AND DOREEN THOMPSON CHARITABLE FOUNDATION INC.,"650 WEST GEORGIA ST, SUITE 510, VANCOUVER, BC, V6B4N7, CA",49.2818976,-123.1179129
Home of Good Hope in Namibia Foundation,"505 - 1178 BEACH DR, VICTORIA, BC, V8S2M9, CA",48.4127284,-123.3085975
RUN FOR WATER FOUNDATION,"201 - 2020 ABBOTSFORD WAY, ABBOTSFORD, BC, V2S6X8, CA",49.0392501,-122.2766706
YAHWEH SAVES RECOVERY MINISTRIES,"35137 MT BLANCHARD DR, ABBOTSFORD, BC, V2S6T3, CA",49.0633793,-122.2512924
DELTA KING PLACE HOUSING SOCIETY,"277 CITY CENTRE, KITIMAT, BC, V8C1T6, CA",54.0529428,-128.6526412
BC EMERGENCY HEALTH SERVICES FOUNDATION,"200 - 1333 BROADWAY W, VANCOUVER, BC, V6H4C1, CA",49.26386979999999,-123.1342545
LCS LANGLEY CHRISTIAN SCHOOL FOUNDATION,"22930 48TH AVENUE, LANGLEY, BC, V2Z2T9, CA",49.0885358,-122.5893901
CENTRAL AIR SEARCH & RESCUE SOCIETY,"110 - 201 WYLIE ST, PENTICTON, BC, V2A0H3, CA",49.4974199,-119.6139624
CW ASIA FUND FOUNDATION,"P.O. BOX 11516, 2160-650 WEST GEORGIA STREET, VANCOUVER, BC, V6B4N7, CA",49.2818976,-123.1179129
GDB INTERNATIONAL,"SUITE 1800-510 WEST GEORGIA ST, VANCOUVER, BC, V6B0M3, CA",49.2809904,-123.1169992
The 625 Powell Street Foundation,"4649 HASTINGS ST, BURNABY, BC, V5C2K6, CA",49.2811661,-122.9984912
